title,genre,running_time,release_date,director,actor,rating,summary
컨벤트,공포,81분,2019 .07.25 개봉,폴 하이엣,"한나 아터튼(페르세포네), 마이클 아이언사이드, 로지 데이(에밀린 수녀)",청소년 관람불가,"한마을에서 마녀라고 불리던 '페르세포네'는 악령이 씌었단 이유로 사형을 선고받는다.
 사형 직전, 유카리스트 수녀원장은 '페르세포네' 변호를 자처해 간신히 사형을 피하게 된다.
 하지만, 죄를 씻어 내기 위해 간 수녀원에서는 계속해서 의문의 희생자들이 발생하고,
 이상함을 감지한 '페르세포네'는 더 사악한 것에 사로잡히게 되며,
 충격적인 악령의 실체를 보게 되는데..."
컨저링 맨션,"공포, 스릴러, 미스터리",118분,2019 .08.13 개봉,찰리 스티즈,"로웨나 벤틀리(레디이 위플리), 이스미 시어스(코데타 크림슨 로즈)",청소년 관람불가,크림슨 로즈는 외딴 언덕 꼭대기의 위플리 가족의 저택에서 가정부로 일하게 된다. 외부인으로부터 철저히 고립된 채 사는 가족은 일견 평범해 보이지만 크림슨은 자꾸 알 수 없는 두려움을 느낀다. 거기다가 미스터리한 방문객까지 등장하면서 가족들의 충격적인 행적들이 하나둘 드러난다. 살고 싶다면 이제 이 가족의 손아귀를 벗어나야만 한다.
컨저링 하우스,"공포, 스릴러",80분,2019 .07.01 개봉,미키 맥그래거,"제시 제임스, 클레이튼 스니더",15세 관람가,한 무리의 도시 탐험가들은 언뜻 보기에도 낡고 아무도 살 것 같지 않은 버려진 고아원에 침입한다. 고아원에 들어선 순간부터 느껴지는 불길한 기운! 그들은 한 소녀가 자신들을 노리고 있음을 알아차린다. 이제 탐험가들의 목숨을 건 어둠 속 게임이 시작된다.
컨저링: 아미티빌의 저주,"공포, 스릴러",75분,2019 .09.26 개봉,척 모론지엘로,척 모론지엘로,15세 관람가,"플로리다에 거주하고 있는 찰리와 부쉬 커플은 유령애호가들로 휴가철이면 심령현상이 발견되는 곳에서 휴가를 즐기는 커플이다.
 이번 여행은 뉴욕주의 롱 아일랜드에 위치한 미저리 로드의 괴기한 소문과 유령을 찾기 위해 계획을 세우는데, 미저리 로드에 관해 물어보는 사람마다 그 지역의 위험함을 경고하며 계획을 취소하라고 조언해주지만, 커플은 오히려 재미있어 하며 경고를 무시하고 미저리 로드 숲속을 향해 들어가게 되는데…"
코끼리는 그곳에 있어,드라마,234분,2019 .11.21 개봉,후 보,"팽욱창, 왕위원, 장 위",12세 관람가,"1. 친구의 부인과 불륜. 사실을 알게 된 친구는 내 눈앞에서 투신자살했다.
 
 2. 학교 폭력에 휘말렸는데, 가해자를 다치게 했다. 중태 상태다. 나는 살인자가 될 것 같다.
 
 3. 가족들에게 버려져 양로원에 가게 되었다. 그리고 가장 사랑하는 강아지가 사고로 죽었다.
 
 4. 원조 교제 사실이 전교생에게 공개되었다. 엄마도 나를 포기했다.
 
 지독한 현실, 탈출구 없는 삶
 만저우리에 가면 코끼리를 만날 수 있을까?"
콘택트: 지구 최후의 날,"SF, 액션",107분,2019 .10.16 개봉,기요로기 폴피,"에릭 피터슨, 마샬 윌리엄스, 케이트 버논",청소년 관람불가,"1981년 콜로라도 주, 의문의 폭발 사고! 사라진 아버지를 찾아 미국으로 돌아 온 페터는 아버지가 '라 팔로마'라는 연구시설에서 일했으며 폭발사고와도 관계가 있다는 충격적 사실을 알게 된다. 감마선 폭발을 일으켰던 우주 기술의 비밀을 알게 된 페터. 이제 지구의 운명이 그의 손에 달렸다."
콜드 워,"드라마, 멜로/로맨스",88분,2019 .02.07 개봉,파벨 포리코브스키,"요안나 쿨릭(줄라), 토마즈 코트(빅토르)",15세 관람가,"1949년 폴란드, 그와 그녀가 음악으로 처음 만났다
 1952년 베를린, 함께하려면 이곳을 떠나야 한다
 1954년 파리, 영원한 이별인 줄 알았는데 운명적으로 다시 만나다
 1959년 폴란드, 처음 만난 이곳에서 사랑을 완성할 수 있을까?"
콜드 체이싱,액션,118분,2019 .02.20 개봉,한스 페터 몰란트,"리암 니슨(넬스 콕스맨), 톰 베이트먼(바이킹)",15세 관람가,"평범한 제설차 운전수이자 올해의 모범시민 ‘넬스 콕스맨’.
 법 없이도 살 수 있던 그는 마약 조직의 사이코패스 보스 ‘바이킹’이 꾸며낸
 아들의 처참한 죽음 앞에서 분노의 심판자로 다시 태어난다.
 
 ‘스피도’, ‘림보’, ‘산타’ 등 마피아들을 연달아 처단하며 그들의 소굴에 한 걸음 가까워질수록
 ‘넬스’의 분노는 죽음도 대신할 수 없는 깊은 복수심으로 소용돌이 치는데…
 
 당한 만큼 갚아주는 냉혈한 복수가 시작된다!"
콜레트,드라마,112분,2019 .03.27 개봉,워시 웨스트모어랜드,"키이라 나이틀리(콜레트), 도미닉 웨스트(윌리)",15세 관람가,"프랑스 생 소뵈르 작은 마을의 소녀 콜레트
 바람둥이 소설 편집자 윌리와 사랑에 빠져 파리에 왔지만 기대만큼 행복하지 않다
 파리의 콧대 높은 사교계와 화려하기만 한 물랑루즈에 지쳐갈 무렵
 경제적 어려움에 처한 윌리의 부탁으로 자신의 경험을 녹인 소설을 쓰게 된다
 
 콜레트의 소설은 남편의 이름으로 출판되어 베스트셀러에 오르고
 급기야 소설 속 주인공 이름을 딴 브랜드까지 런칭,
 모든 상품들을 완판시키며 신드롬을 일으킨다
 패션, 헤어스타일까지 유행을 이끌며 최고의 인플루언서가 되지만
 모든 성공과 명예는 남편 윌리에게 돌아간다
 남편 뒤에 숨어있던 콜레트는 용기를 내어 자신의 존재를 드러내기로 결심하는데…
 
 더 이상 사랑을 위해 희생하지 않고,
 남들의 시선을 위해 치장하지 않기로 결심한 콜레트!
 그녀가 이제, 진짜 세상으로 당당히 걸어 나온다!"
쿠르스크,드라마,118분,2019 .01.16 개봉,토마스 빈터베르그,"마티아스 쇼에나에츠(미하일 카레코프), 콜린 퍼스(데이빗 러셀), 레아 세이두(타냐 카레코프)",15세 관람가,"평범한 토요일 아침,
 해군 대위 ‘미하일’(마티아스 쇼에나에츠)은 핵잠수함 쿠르스크에 승선한다.
 출항 직후 예기치 못한 폭발로 잠수함이 침몰하고,
 두 번째 폭발로 쿠르스크 선체에 큰 구멍이 뚫린다.
 
 그 시각 남편의 소식을 들은 ‘미하일’의 아내 ‘타냐’(레아 세이두)는
 그의 생사를 확인하려 하지만 아무 소식도 들을 수 없고
 러시아 정부는 영국군 준장 ‘데이빗’(콜린 퍼스)의 구조 지원도 마다한 채 시간만 보내는데…
 
 두 번의 폭발과 침몰한 잠수함, 118명 중 확인된 생존자는 단 23명
 그들은 끝까지 믿음을 잃지 않았다"
쿠엔틴 타란티노 8,다큐멘터리,101분,2019 .10.30 개봉,타라 우드,"사무엘 L. 잭슨(본인), 크리스토프 왈츠(본인), 제이미 폭스(본인)",청소년 관람불가,"예술적 쿠데타 <저수지의 개들>부터 타란티노 스타일의 정점 <헤이트풀8>까지
 유혈낭자 폭력으로 뒤섞인 B급 무비의 최정상 영화광 쿠엔틴 타란티노.
 이 작품은 지금 이 시대 가장 위험한 감독인 그를 향한 집요한 시선이다."
쿵푸 보이,애니메이션,95분,2019 .10.09 개봉,"라지브 칠라카, 비나약 다스","최원형(바오 목소리), 문선희(초링 / 링링 목소리), 조예신(브래드 / 자오 목소리)",전체 관람가,"세계 최고의 무술 1인자를 가리는 대회가 열리는 날, 쿵푸가 특기인 소년 ‘초탄’도 대회에 참가한다.
 그러던 사이, 용의 힘을 지닌 공주가 악당에게 납치되는데…
 공주를 구하기 위해 용감한 소년 ‘초탄’과 쿵푸 어벤져스가 뭉쳤다! 아뵤~!"
쿵푸 워리어,액션,83분,2019 .03.26 개봉,고든 와델,"키 찬, 패트릭 톰슨",15세 관람가,"태어나자 마자 사찰 계단에 버려진 아이, 화이트. 그는 사찰의 전설적인 쿵푸 마스터 텐진의 제자로서 사찰과 관음불상의 수호자로 자란다.
 그러던 중 사찰 박물관을 개관하는 날, 관음불상의 천문학적 가치를 알게 된 도둑들이 불상과 함께 화이트의 여자 시에라를 납치하고, 쿵푸 마스터 텐진을 쓰러뜨린다.
 이로 인해 화이트는 복수심을 불태우게 되는데…
 그는 스승의 복수를 완수하고 관음불상과 시에라를 되찾을 수 있을 것인가!"
클라우스,"애니메이션, 코미디, 가족",96분,2019 .11.15 개봉,"서지오 파블로스, 카를로스 마르티네즈 로페즈","제이슨 슈왈츠먼, J.K. 시몬스, 라시다 존스",전체 관람가,"편지 6천 통을 배달하라고요? 소통은커녕 싸움만 일삼는 마을에서요? 불가능해 보이는 임무에 좌절한 우체부. 그냥 포기하려던 차, 장난감 장인을 만나 아이디어가 떠오른다. 아이들에게 장난감을 줄 테니 편지를 쓰라고 하는 거야!"
키코리키: 시간여행,"애니메이션, 모험, 코미디",78분,2019 .04.10 개봉,데니스 체르노프,"이경태(크래쉬 목소리), 이상헌(쉬래크 목소리), 김정훈(두더지 사원 목소리)",전체 관람가,"평화롭고 한적한 마을에 사는 사고뭉치 개구쟁이 토끼 크래쉬는
 친구 배리에게 잊지 못할 생일 파티를 선사하기 위해 키코리키 친구들과 회의를 한다.
 조용하고 차분한 파티를 원하는 친구들과는 달리 신나게 파티를 보내고 싶던
 크래쉬는 시간 여행 서비스를 제공하는 데자뷰 여행사에 연락을 하게 된다.
 하지만 여행사 직원인 두더지 사원의 계략에 빠져
 키코리키 친구들은 과거시대로 뿔뿔이 흩어지게 되고
 설상가상 크래쉬도 의문의 사건으로 인해
 두더지 사원에게 쫓기게 되면서 위기를 맞게 되는데...
 
 과연 크래쉬와 키코리키 친구들은 버라이어티한 시간여행을 마치고
 무사히 마을로 돌아 올 수 있을까?"
킹 다닐로,"액션, 모험",85분,2019 .06.27 개봉,타라스 카이미흐,세히 이아르모센코(킹 다닐로),15세 관람가,"위대한 통치자 로만 공작이 죽은 뒤, 귀족들이 권력을 나누어 가져 나라가 흉흉할 때, 공작의 두 아들인 다닐로와 바실코는 아버지의 유산을 되찾기 위해 수도를 홀름으로 새로이 정하고 왕국을 넓힌다.
 이때 중앙 유럽에서 세를 넓히고 있던 몽골은 다닐로에게 큰 위협이 되고 다닐로를 눈엣가시로 여기던 귀족들은 몽골과 협약을 맺어 다닐로를 없애버리려는 계획을 세운다.
 대대적인 군사를 이끌고 몽골과 전쟁을 치른 다닐로는 계속되는 몽골과 귀족의 위협에 새로운 전쟁을 치르려 하는데..."
킹 오브 프리즘 -샤이니 세븐 스타즈-,애니메이션,70분,2019 .03.07 개봉,히시다 마사카즈,"테라시마 쥰타, 사이토 소우마, 하타나카 타스쿠",12세 관람가,"킹 오브 프리즘 -샤이니 세븐 스타즈-
 KING OF PRISM -Shiny Seven Stars-
 I 프롤로그×유키노조×타이가
 모두가 뜨거웠던 그때의 두근거림을 당신은 기억하고 있나요?
 피겨스케이트, 노래, 댄스, 그리고 마음의 비약을 구현한 프리즘 쇼 세계에서
 스타를 꿈꾸는 7명의 소년들의 이야기가 시작된다.
 에필로그와 함께 그려지는
 그 첫 번째 이야기.
 진정한 자신의 모습을 마주하려는 유키노조와
 거칠어 보이지만 축제를 사랑하는 순수한 소년, 타이가
 과연 그들은 자신들의 꿈을 마주할 수 있을 것인가?"
킹 오브 프리즘 -샤이니 세븐 스타즈- Ⅲ 레오x유우x알렉,애니메이션,71분,2019 .05.02 개봉,히시다 마사카즈,"나가츠카 타쿠마(사이온지 레오 목소리), 우치다 유우마(스즈노 유우 목소리), 타케우치 슌스케(야마토 알렉산더 목소리)",12세 관람가,"피겨스케이트, 노래, 댄스, 그리고 마음의 비약을 구현한 프리즘 쇼 세계에서
 스타를 꿈꾸는 7명의 소년들의 이야기가 시작된다.
 
 있는 그대로의 자신을 잃지 않기 위해 노력하는 레오와
 오버 더 레인보우와 같은 진정한 동료를 소망하는 유우
 그리고 스트리트 계의 카리스마를 노리는 알렉산더
 
 그들은 어떠한 사연으로
 프리즘스타가 되려고 하는 것일까?
 
 자신의 꿈을 좇는 소년들의
 세 번째 이야기!"
킹 오브 프리즘 -샤이니 세븐 스타즈- Ⅳ 루이x신x언노운,애니메이션,70분,2019 .05.30 개봉,히시다 마사카즈,"테라시마 쥰타, 아오이 쇼타",15세 관람가,"슈왈츠로즈 VS 에델로즈의 대항전인 ‘PRISM.1’은 지금까지 여섯 조의 무대가 끝났다,
 처음에는 에델로즈가 우위에 있었으나, 타이가의 감점 처분 등으로
 최종 두 무대를 남기고 슈왈츠로즈가 약간 앞서고 있는 상황.
 
 마지막 솔로 대항전은 신과 루이.
 막상막하의 실력을 지닌 두 사람의 프리즘 쇼 대결 결과는…?!"
킹 오브 프리즘-샤이니 세븐 스타즈-ⅱ카케루x조지x미나토,애니메이션,71분,2019 .04.04 개봉,히시다 마사카즈,테라시마 쥰타,12세 관람가,"모두가 뜨거웠던 그때의 두근거림을 당신은 기억하고 있나요?
 
 피겨스케이트, 노래, 댄스, 그리고 마음의 비약을 구현한 프리즘 쇼 세계에서
 스타를 꿈꾸는 7명의 소년들의 이야기가 시작된다.
 
 늘 가벼워 보이지만 프리즘 쇼와 일에 있어서는 누구보다 진지한 카케루와
 언제나 큰 형처럼 따스히 동료들을 보살펴주는 미나토
 그리고 슈왈츠로즈의 미워할 수 없는 야망가 조지까지
 
 그들은 어떠한 사연으로
 프리즘스타가 되려고 하는 것일까?
 
 자신의 꿈을 좇는 소년들의
 그 두 번째 이야기가 시작됩니다!"
타이페이 스토리,드라마,119분,2019 .11.07 개봉,에드워드 양,"허우 샤오시엔(아룽), 채금(수첸)",15세 관람가,"흘러가는 과거에 안주하며 방직공장를 운영하는 ‘아룽’과
 새로운 시대의 흐름을 타는 자유로운 사고의 커리어우먼 ‘수첸’.
 같은 공간에서 서로 다른 꿈을 꾸던 이 연인의 관계는 점차 무너지기 시작한다."
타인은 지옥이다,"드라마, 멜로/로맨스",99분,2019 .04.11 개봉,이영용,"김동우(진영), 양희우(현석), 최보윤(지숙)",15세 관람가,"고등학교 동창 다섯 명이 오랜만에 캠핑장에 모인다.
 이 중 평범한 회사원 '진영'과 외주방송제작사 피디 '현석'은 노총각이다.
 이번 캠핑엔 '수락'이 친하게 지내는 동생이라며 데려온 '선미'와 '지숙'도 함께다.
 들뜬 첫 만남 속에서 점차 캠핑 분위기가 무르익고,
 시간이 지날수록 '진영'과 '현석' 그리고 '지숙' 간에는 미묘한 기류가 형성된다.
 얽히고 설킨 세 사람의 관계, 그와 그녀가 숨기고 싶었던 것들이 점차 드러난다."
타임 워프 워,"액션, 모험, 드라마",100분,2019 .02.14 개봉,드미트리 티우린,"파벨 프릴루치니, 옐레나 랴도바",15세 관람가,"채석장을 짓기 위해 공사를 진행하려던 미카일은 유해 발굴을 위해 공사를 중단해달라고 부탁하는 엘리자베타에게 첫눈에 반한다.
 하지만 둘은 공사 담당자의 실수로 큰 부상을 입고, 미카일은 과거로 돌아가게 된다.
 그 곳에서 전쟁을 겪으며 주변의 군인들이 자신과 연관이 있음을 알게되는데…"
타임 트랩 킬러,"액션, SF",84분,2019 .03.05 개봉,저스틴 루이스,"크리스틴 마스콜로(마야), 엘레나 로즈 데이비스(안젤리카), 마이클 바리첵(존)",15세 관람가,"2033년, 시간여행 통제 기업 보육원에 살고 있는 소녀 마야는 자기를 죽이러 온 어떤 남자를 마주치고 이내 정신을 잃는다.
 마야는 깨어난 후, 보육원에서 사건을 은폐하려는 듯한 낌새를 채게 되면서
 비밀 연구소장 존을 찾아가 2016년으로 단 하루의 시간을 허락 받는다.
 
 2016년으로 하루의 타임 트랩을 허락 받은 마야,
 곧이어 조직의 사람들이 그녀를 추격하기 시작하고
 자신을 죽이려 했던 남자가 실은 아버지였음을 알게 되는데…
 
 17년 전으로 돌아간 단 하루의 타임 트랩, 영원히 돌이킬 수 없는 추격이 시작된다!"
타짜: 원 아이드 잭,"범죄, 드라마",139분,2019 .09.11 개봉,권오광,"박정민(도일출), 류승범(애꾸), 최유화(마돈나)",청소년 관람불가,"전설적인 타짜 ‘짝귀’의 아들이자 고시생인 ‘일출’(박정민)은 공부에는 흥미가 없지만
 포커판에서는 날고 기는 실력자다. 포커판에서 우연히 알게 된 ‘마돈나’(최유화)의 묘한 매력에 빠져든 일출은
 그녀의 곁을 지키는 ‘이상무’(윤제문)에게 속아 포커의 쓴맛을 제대로 배운다.
 돈도 잃고 자존심까지 무너진 채 벼랑 끝에 몰린 도일출, 그의 앞에 정체불명의 타짜 ‘애꾸’(류승범)가 나타난다.
 
 거액이 걸린 거대한 판을 설계한 애꾸는 전국에서 타짜들을 불러모은다.
 일출을 시작으로 셔플의 제왕 까치(이광수), 남다른 연기력의 영미(임지연), 숨은 고수 권원장(권해효)까지
 무엇이든 될 수 있고, 누구든 이길 수 있는 ‘원 아이드 잭’ 팀으로 모인 이들, 인생을 바꿀 새로운 판에 뛰어드는데…
 
 베팅을 할 때는 인생을 걸어야지! 타짜니까!"
텔 잇 투 더 비즈,드라마,108분,2019 .10.31 개봉,아나벨 얀켈,"안나 파킨(진), 홀리데이 그레인저(리디아)",15세 관람가,"1952년 스코틀랜드 작은 시골 마을.
 각자의 상처를 가지고 살아가던 싱글맘 ‘리디아’와 여의사 ‘진’은
 리디아의 아들 ‘찰리’를 통해 우연히 만나게 된다.
 
 곤경에 처한 리디아를 위한 진의 배려로 세 사람은 한 집에 살게 되고,
 진이 키우는 벌들은 찰리의 비밀을 들어주는 둘도 없는 친구가 되어준다.
 
 시간이 지날수록 리디아와 진은 서로에게 이끌리고,
 두 사람의 비밀이 마을에 퍼지면서 선택의 기로에 서게 되는데…"
토막살인범의 고백,"드라마, 스릴러",86분,2019 .10.17 개봉,리누스 드 파올리,"아담 일드 로웨더(피트), 파울리나 갈라즈카(클라라)",청소년 관람불가,"천재적인 재능으로 교수님의 총애를 듬뿍 받고 있는 프로그램 개발자 피트.
 연구에만 몰두하며 외톨이로 지내지만 언제나 밝고 환한 클라라에게 마음을 빼앗기게 된다.
 
 그러던 어느 날, 클라라와 함께 논문 과제를 하게 된 피트는
 그녀와 가까워졌단 생각에 고백을 하게 되지만 클라라는 거절하고,
 두 사람의 사이는 어색해진다.
 
 실연의 상처로 방황하던 피트에게 미안한 클라라는 그를 위로해주기 위해 집으로 찾아간다.
 그러나 클라라가 피트의 집으로 갔던 그날 이후, 그녀의 모습은 그 어디에서도 찾을 수가 없게 되는데…"
토이 스토리 4,"애니메이션, 모험, 코미디, 가족, 판타지",100분,2019 .06.20 개봉,조시 쿨리,"톰 행크스(우디 목소리), 팀 알렌(버즈 라이트이어 목소리), 애니 파츠(보 핍 목소리)",전체 관람가,"장난감의 운명을 거부하고 떠난 새 친구 ‘포키’를 찾기 위해 길 위에 나선 ‘우디’는
 우연히 오랜 친구 ‘보핍’을 만나고 그녀를 통해 새로운 세상에 눈을 뜨게 된다.
 한편, ‘버즈’와 친구들은 사라진 ‘우디’와 ‘포키’를 찾아 세상 밖 위험천만한 모험을 떠나게 되는데…"
퇴마 포송령: 천녀유혼전,"판타지, 코미디",109분,2019 .05.02 개봉,얀 지아,"성룡, 원경천, 종초희",15세 관람가,"요괴 이야기로 아이들을 놀리는 재미로 살아가는 ‘포송령’
 어느 날, 마을의 소녀들이 사라진다는 소문을 듣고
 기상천외 요괴들과 함께 사건을 추적하기 시작한다.
 음양의 붓으로 퇴마를 시도하지만 미녀 요괴에게 번번이 당하고
 인간과 미녀 요괴의 기이한 사랑을 알게 되는데…
 
 상.상.초.월 신화 속 요괴들이 깨어나기 시작했다!
 천년의 전설이 부활한다!"
툼 인베이더,"액션, 모험",83분,2019 .02.05 개봉,제임스 토마스,사만다 보링,15세 관람가,"탐험 중 사망한 고고학자인 어머니의 뒤를 이어 고고학 박사가 된 앨리는 어느 날, 어머니의 탐험일지를 전해주러 온 묘연의 인물에게서 뜻밖의 제안을 받는다.
 바로 어머니가 발굴하려다 사망한 진시황의 무덤 속 ‘용의 심장’을 함께 찾자는 것이었다.
 베일에 싸인 이 유물을 발굴하려 앨리는 동료들과 함께 중국에 와서 이 일을 제안한 팀 파커와 옛 동료 네이슨을 만나지만, 그들이 자신을 이용해 유물을 훔쳐 거금을 챙기려는 듯한 낌새를 채게 된다.
 그럼에도 앨리는 어머니의 자취를 따라 그들과 위험한 동행을 하게 되지만, 멸망한 왕조의 후손들에게 무차별 공격을 당하고 치명적인 함정들에 부딪히기 시작하는데….
 수백 년 봉인된 무덤을 둘러싼 사상 초유의 대결이 시작된다!"
트러블 위드 유,"드라마, 코미디",108분,2019 .09.26 개봉,피에르 살바도리,"아델 하에넬, 피오 마르마이, 오드리 토투",15세 관람가,"지역의 영웅이자, 자랑스러운 남편이었던 상티 경찰서장의 부인 '이본' 형사.
 갑작스러운 사고로 죽음을 맞이한 상티를 향한 슬픔이 채 가시기도 전에,
 이본은 그가 사실은 부정한 경찰이었다는 사실을 알게 된다.
 
 죄 없는 사람을 체포하여 자신의 실적을 쌓아올렸던 상티.
 이본은 그가 저지른 잘못을 바로잡기 위해 노력한다.
 그러던 중 상티의 희생자였던 앙투안과 마주치면서 요상한 관계로 발전되는데..."
트레킹: 저주의 숲,모험,96분,2019 .07.11 개봉,릭 오스터만,"올리버 마수치, 루이스 호프만",15세 관람가,"아내의 갑작스러운 죽음으로 아들과 헤어지게 된 아버지.
 10년 만에 재회를 앞둔 부자는 서로 가까워지기를 기대하며 산악 여행을 계획한다.
 하지만 두 사람 모두 쉽게 마음을 열지 못하고 서로를 비난하기 바쁘다.
 엎친 데 덮친 격으로 장비까지 모두 잃어버리고, 즐거워야 할 여행은 어느새 생존을 위한 싸움이 되는데.."
트로이 그레이트 워,"액션, 전쟁, 모험",90분,2019 .01.29 개봉,테킨 길긴,딜런 복스,15세 관람가,"기원 전 1184년, 트로이에 빼앗긴 스파르타의 왕비 헬렌을 되찾기 위해 그리스 도시국가의 연합대군이 트로이를 공격하지만 10년이 지나도록 트로이의 요새는 함락되지 않던 때, 이타카의 군주 오디세우스는 ‘트로이 목마’ 전술을 떠올린다. 이를 이용해 오디세우스와 그리스 정예병은 전쟁을 승리로 이끌고 그리스의 영웅이 된다. 오디세우스는 임신 후 홀로 출산했을 아내와의 10년만의 재회를 기대하며 귀향길에 오르지만, 이내 함선에 거대한 풍랑이 덮쳐 오고 뒤이어 트로이 여사제의 사주를 받은 괴물의 공격이 시작되는데…"
트루 시크릿,"드라마, 멜로/로맨스, 미스터리",102분,2019 .10.03 개봉,사피 네부,줄리엣 비노쉬(클레르 미요),청소년 관람불가,"겉으로는 완벽한 그러나 사실, 외롭고 쓸쓸한
 50살의 중년 여성 클레르 미요는
 연하의 남자친구 뤼도를 감시하기 위해
 24살 클라라로 SNS 가짜 계정을 만든다.
 그러나 의도치 않게 뤼도의 친구 알렉스가 클라라에 빠져버리고
 클레르 또한 클라라로서 그와 사랑에 빠지고 만다."
트리트 미 라이크 파이어,"드라마, 멜로/로맨스, 범죄",107분,2019 .06.27 개봉,마리 몽쥬,"타하르 라힘(아벨), 스테이시 마틴(엘라)",청소년 관람불가,"자신이 일하는 레스토랑에 일자리를 달라고
 당당히 요구하는 남자 아벨과 우연처럼 만난 엘라는
 자유롭고 어딘지 위험해 보이는 아벨에게 운명처럼 강렬한 끌림을 느낀다.
 
 마치 계획된 것처럼 아벨에게 이끌려 게임의 세계에 발을 들인 엘라는
 시간이 갈수록 아벨의 모든 것에 중독된다.
 자신의 모든 것을 잃더라도 사랑을 지키고 싶었던 엘라는 자신을 이용한 아벨의 뒤를 쫓게 되는데…"
