title,genre,running_time,release_date,director,actor,rating,summary
러브리스,드라마,127분,2019 .04.18 개봉,안드레이 즈비아긴체프,"마리아나 스피바크(제냐), 알렉세이 로진(보리스), 마트베이 노비코프(알로샤)",15세 관람가,"제냐와 보리스는 이혼을 준비 중이다.
 더 이상 서로를 견딜 수가 없는 것이다.
 분노와 좌절만이 남은 결혼 생활은
 자연스럽게 끝을 향해 달려간다.
 이미 두 사람은 각자의 연인을 만나
 새로운 삶에 대한 기대감으로 잔뜩 들떠있다.
 열두 살밖에 되지 않은 아들 알로샤는
 그들의 새로운 시작에 걸림돌일 뿐이다.
 
 어느 날, 소년은
 부모가 자신을 서로에게 떠넘기려 한다는 사실을 듣게 된다.
 다음 날 알로샤는 사라지고
 부부는 뒤늦게 알로샤를 찾으려 한다."
런던 워리어,액션,98분,2019 .04.11 개봉,그렉 버릿지,그렉 버릿지,15세 관람가,"대런 벡스터는 10년 만에 런던 브리타니아 지구로 돌아온다.
 떠난 사이 고향은 낯선 도시로 변해 있다.
 세 갱단이 폭력과 마약을 이용해 불황으로 빈곤을 겪는 주민들을 지배한다.
 대런은 남동생 애덤을 미국으로 유학 보내기 위해 일을 구하려 애쓰지만 마땅한 일은 없고,
 10년 만에 만난 여동생 뎁스와 감정의 골을 메우기도 쉽지 않다.
 한편 과거의 지인이자 갱단의 리더인 프랭크가 애덤에게 접근하고,
 대런은 가족을 어둠으로부터 키려고 고군분투하는데..."
레고 무비2,"애니메이션, 액션, 모험, 가족, 코미디",107분,2019 .02.06 개봉,마이크 미첼,"크리스 프랫(에밋/터프가이 렉스 목소리), 엘리자베스 뱅크스(루시 목소리), 윌 아넷(배트맨 목소리)",전체 관람가,"시스타 행성의 지멋대로 여왕의 지시로 듀플로 외계인들이 레고 마을을 침공한다.
 어마무시 장군이 친구들을 납치하자 에밋은 우주로의 여행을 떠나는데…
 에밋과 친구들의 대모험, 이번엔 우주다! 준비됐나요?"
레드,드라마,16분,2019 .08.14 개봉,델 캐서린 바튼,케이트 블란쳇,15세 관람가,짝짓기 후 수놈을 잡아먹는 호주 붉은등거미를 모티브로 한 케이트 블란쳇 주연의 비디오 아트
레드 스프링 아포칼립스,"액션, 공포",104분,2019 .01.10 개봉,제프 시나삭,제프 시나삭,15세 관람가,"인류가 벌인 실수로 퍼진 뱀파이어 바이러스로 초토화 된 지구. 문명은 파괴되고
 레이를 비롯한 생존자들은 인간의 피를 얻기 위해 무자비한 괴물로 변한 흡혈인간들을
 피해 살아가고 있다. 그러던 중 사방이 막힌 비밀 벙커를 발견하고 이를 안전가옥으로
 삼아 생존을 위한 터전으로 삼으려 한다. 하지만 점점 영악해지는 뱀파이어 인간들의
 공격은 날로 강해지고 결국 벙커에까지 침입하게 되면서 생존을 건 최후의 대결이 벌어진다."
레드슈즈,"애니메이션, 모험, 코미디, 판타지, 멜로/로맨스",92분,2019 .07.25 개봉,홍성호,"클로이 모레츠(스노우 화이트 목소리), 샘 클라플린(멀린 목소리), 지나 거손(레지나 목소리)",전체 관람가,"사건 사고가 끊이지 않는 동화의 섬. 사라진 아빠를 찾던 화이트 왕국의 공주는
 우연히 마법구두를 신고 이전과 완벽하게 다른 ‘레드슈즈’로 거듭난다.
 한편, 초록색 난쟁이가 된 일곱 왕자들은 우연히 자신들의 집에 머물게 된 '레드슈즈’가
 저주를 풀 유일한 희망이라 생각해 그녀를 돕기 시작하고, 영원한 아름다움을 꿈꾸는 왕비 ‘레지나’는
 마법구두를 신고 성을 빠져나간 ‘레드슈즈’를 쫓기 시작하는데…
 
 위기에 빠진 동화의 섬,
 레드슈즈, 그리고 일곱 왕자들의 운명은?"
레인보우: 나의 사랑,"멜로/로맨스, 드라마",84분,2019 .01.03 개봉,파올로 타비아니,"루카 마리넬리(밀톤), 발렌티나 벨레(풀비아), 로렌조 리첼미(조르조)",12세 관람가,"1943년 이탈리아 피에몬테,
 영문학에 매료된 청년 밀톤은 사랑하는 여인 풀비아에게
 '오버 더 레인보우' 레코드를 선물하고 언제나 편지를 쓴다.
 
 1년 뒤 풀비아가 떠난 후,
 친구 조르조와 레지스탕스로 활동하는 밀톤은
 조르조가 그녀와 남몰래 만나왔다는 사실을 알게 된다.
 
 사랑의 깊이만큼 밀톤의 감정이 휘몰아친다."
레토,드라마,128분,2019 .01.03 개봉,키릴 세레브렌니코프,"유태오(빅토르 최), 로만 빌릭(마이크), 이리나 스타르셴바움(나타샤)",15세 관람가,"1981, 레닌그라드
 자신만의 음악을 하고 싶은 자유로운 뮤지션 ‘빅토르 최’
 금기의 록음악을 열망하는 열정적인 록스타 ‘마이크’
 그리고 그의 매력적인 뮤즈 ‘나타샤’
 음악이 있어 빛나고, 사랑이 있어 아름답고, 젊음이 있어 찬란한
 그들의 끝나지 않을 여름이 시작된다"
레플리카,"범죄, 미스터리, SF, 스릴러",107분,2019 .09.25 개봉,제프리 나크마노프,"키아누 리브스(윌 포스터), 앨리스 이브(모나 포스터), 토머스 미들디치(에드 휘틀)",15세 관람가,"한 순간의 사고로 가족을 모두 떠나 보낸 생명 공학자 ‘윌’은
 인간복제라는 금기의 실험에 성공한다.
 
 하지만 사랑하는 이들을 되살려낸 행복도 잠시,
 클론이 된 가족들은 조금씩 이상징후를 보이기 시작하고
 인간복제 알고리즘을 노리는 거대 조직으로부터 쫓기게 되는데…
 
 그가 되살려낸 것은
 희망인가 죄악인가"
려행,다큐멘터리,86분,2019 .08.08 개봉,임흥순,"강유진(본인), 김경주(본인), 김광옥(본인)",12세 관람가,"지금 여기, 용감한 여행을 떠나온 그녀들
 열 개의 여정 그러나 하나의 마음으로 다시 떠나는
 <위로공단> 임흥순 감독의 아주 특별한 휴먼 바캉스"
로드킬,"공포, 스릴러",96분,2019 .02.21 개봉,이수성,"이철민(최오광), 오광록(장씨)",청소년 관람불가,"악랄한 부동산 업자 오광은 재개발 사업 건으로 급하게 산길을 운전하다 사고를 당하고 외딴 산속 장씨 집에서 이틀 만에 깨어난다.
 오광을 발견한 장씨 가족은 큰 비로 다리가 끊기고 전화마저 불통이라 오광을 집에 데려왔던 것.
 장씨와 아내 연희, 그들의 아들 현석과 딸 소희까지 장씨 가족은 친절하게 오광을 도와 준다.
 하지만 재개발 건으로 마음이 급한 오광은은 장씨 가족의 만류에도 혼자 집을 나섰다가 길을 잃고 산속을 헤매다 다리까지 다치고 만다.
 다친 오광을 다시 도와주는 장씨 가족.
 하지만 친절하기만 했던 장씨 가족은 오광에게 무언가를 숨기는 듯 하고…
 오광은 자신의 과거 악행과 장씨 가족이 연관되어 있다는 걸 알게 되고 목숨을 위협받게 되는데…"
로망,멜로/로맨스,112분,2019 .04.03 개봉,이창근,"이순재(조남봉), 정영숙(이매자), 조한철(조진수)",전체 관람가,"75세 조남봉과 71세 이매자는 치매 부부입니다
 결혼 45년차, 몸도 마음도 닮아진 부부는
 이제 세상에 단 둘만 있는 것처럼 삽니다
 매일 기억이 흐릿해지지만, 먹고 사느라
 잊었던 로망은 점점 더 선명해집니다
 
 “올 것이 왔다 싶으니까 아무렇지도 않아요”"
롱 샷,코미디,125분,2019 .07.24 개봉,조나단 레빈,"샤를리즈 테론(샬롯 필드), 세스 로건(프레드 플라스키)",15세 관람가,"전직 기자 지금은 백수인 ‘프레드 플라스키’(세스 로건)는
 20년 만에 첫사랑 베이비시터 ‘샬롯 필드’(샤를리즈 테론)와 재회한다.
 
 그런데 그녀가!?
 미 최연소 국무 장관이자 세계에서 가장 영향력 있는 여성 중 한 명인 ‘샬롯’이
 바로 베이비시터 그녀라는 것은 믿기지 않지만 실화이다.
 
 인생에 공통점이라고는 1도 없는 두 사람.
 대선 후보로 출마를 준비 중인 ‘샬롯’은 모두의 예상을 깨고
 자신의 선거 캠페인 연설문 작가로 ‘프레드’를 고용한다.
 어디로 튈지 모르는 ‘프레드’ 때문에 선거 캠페인은 연일 비상인 가운데,
 뜻밖에 그의 스파크는 ‘샬롯’과의 로맨스로 튀어 버리는데...
 
 사고 치는데 천부적인 재능이 있는 남자,
 머리부터 발끝까지 완벽한 여자
 
 이 조합 실화?"
루스 베이더 긴즈버그 : 나는 반대한다,다큐멘터리,98분,2019 .03.28 개봉,"벳시 웨스트, 줄리 코헨",루스 베이더 긴즈버그(본인),전체 관람가,"살아있는 영웅, 평등을 위해 싸운 챔피언.
 세상을 뒤집은 위대한 대법관 루스 베이더 긴즈버그
 
 60살에 미연방 대법관이 된 루스 베이더 긴즈버그.
 하버드 로스쿨에서부터 모두가 인정하는 뛰어난 재원이었지만 그녀의 삶은 차별에 맞선 일대기였다.
 법을 통해 불평등한 세상을 반대로 바꾸며 시대의 아이콘이 된 그녀의 감동 스토리가 시작된다."
룩 어웨이,"스릴러, 공포",102분,2019 .08.21 개봉,아사프 베른슈타인,"인디아 아이슬리(마리아 / 애럼), 미라 소르비노(에이미), 제이슨 아이삭스(댄)",15세 관람가,"성형외과 의사인 아빠와 항상 다정다감한 엄마, 그리고 부유한 저택까지 모든 걸 다 가진 듯한 아름다운 소녀 ‘마리아’는 사실 학교에서 심한 따돌림을 당하는 소녀다.
 항상 완벽한 외모를 강요하는 아빠의 강압 때문에 내성적인 성격을 가지게 된 ‘마리아’는 어느 순간 거울 속에서 자신과 똑같이 생긴 ‘애럼’을 마주하게 된다. ‘애럼’과의 대화를 통해 점점 자신감을 얻은 ‘마리아’는 학교 졸업 무도회에 참가하지만 전교생들 앞에서 끔찍한 일을 당하게 되고,
 이 사건으로 큰 충격을 받은 ‘마리아’에게 거울 속 ‘애럼’은 자신과 몸을 바꿔준다면 원하는 모든 것을 얻게 해주겠다며 위험한 거래를 제안하는데…"
리노,"애니메이션, 모험",88분,2019 .03.07 개봉,라파엘 리바스,"조연우(리노 한국어 목소리), 오은수(재닌 한국어 목소리), 방지원(줄리아나 한국어 목소리)",전체 관람가,"못생긴 고양이 분장 전문 파티 플래너 ‘리노’는
 소심한 성격에 되는 일 하나 없는 불만 가득 청년.
 
 하루하루 무기력하게 살아가던 중
 우연히 광고를 보고 찾아간 마법사 ‘돈 레옹’에게
 자신의 인생을 변화시켜 줄 것을 요청하지만
 마법사의 실수로 진짜 고양이로 변하게 된다.
 
 귀엽고 커다란 고양이의 모습에
 난생 처음으로 사람들의 관심을 한 몸에 받지만,
 얼마 안 가 인생 최대의 위기를 맞게 되는데…
 
 과연 ‘리노’는 위기를 극복하고
 원래의 모습으로 돌아갈 수 있을까?"
리지,"범죄, 드라마, 미스터리, 스릴러",105분,2019 .01.10 개봉,크레이그 맥닐,"크리스틴 스튜어트(브리짓 설리번), 클로에 세비니(리지 보든)",청소년 관람불가,"메사추세츠의 대부호 보든 가의 상속녀 리지(클로에 세비니)
 호시탐탐 아버지의 유산을 노리는
 새엄마와 삼촌이 두렵다
 
 그러던 어느 날
 새로 온 하녀 브리짓(크리스틴 스튜어트)이
 리지에게 말을 건네고
 둘은 은밀한 만남을 이어가기 시작한다
 
 ""당신을 위해 무엇이든 할게요"""
마담 싸이코,스릴러,98분,2019 .06.26 개봉,닐 조단,"이자벨 위페르(그레타 히덱), 클로이 모레츠(프랜시스 맥컬린)",15세 관람가,"뉴욕에 살고 있는 젊은 여성 ‘프랜시스’는 지하철에서 주인 없는 핸드백을 줍는다.
 가방의 주인은 혼자 살고 있는 중년의 여인 ‘그레타’.
 
 엄마를 잃은 상실감에 빠져있던 프랜시스는 핸드백을 찾아주면서 그레타와 빠르게 가까워진다.
 저녁식사에 초대받은 프랜시스는 우연히 그레타가 핸드백을 미끼로
 젊은 여성들과 친해진다는 소름끼치는 사실을 알게된다.
 
 그레타는 프랜시스를 집요하게 쫓아다니며 본색을 드러내기 시작하는데…"
마리아 칼라스: 세기의 디바,다큐멘터리,114분,2019 .07.11 개봉,톰 볼프,마리아 칼라스,전체 관람가,"뛰어난 곡 해석력과 마음을 울리는 연기로 전설이 된 디바 칼라스
 하지만 화려한 무대를 내려오면 사랑하는 사람에게 사랑받고 싶었던 그녀, 마리아
 모두가 사랑했지만 끝내 고독했던 디바의 일생이 공개된다!"
마법안개의 비밀: 황금 보물선을 찾아라,애니메이션,76분,2019 .11.14 개봉,"카스파 앤시스, 헨리 니콜슨, 리호 운트",이다은(모튼 한국어 목소리),전체 관람가,"아빠처럼 멋진 선장이 되고 싶은 ‘모튼’은 어느 날 콧수염 마술사 아저씨의 마법안개총에 맞아 몸이 1cm 로 줄어들고 만다!
 갑자기 커져버린 세상에서 구두로 만든 장난감 배의 꼬마 선장이 된 ‘모튼’은 상상 속 곤충 친구들과 함께 전설의 황금 보물선을 찾기 위한 모험을 떠나게 되는데…"
마션 인베이션,SF,95분,2019 .01.03 개봉,해스래프 둘룰,케이티 색코프,12세 관람가,"화성에서 인간이 생존할 수 있는 공간은 오로지 탐사선 뿐.
 탐사 대장 ‘메킨지’는 과연 인간을 배신한 인공지능을 뛰어 넘어, 화성을 탈출하여 살아 남을 수 있을까!"
마술피리,공연실황,150분,2019 .04.28 개봉,리디아 스타이어,아담 플라체트카,15세 관람가,"왕자 타미노는 폭군 자라스트로가 밤의 여왕의 딸, 파미나를 납치해갔다는 사실을 전해 듣는다. 파미나를 구하기로 결심한 왕자는 여왕으로부터 마술피리를, 동행자인 새잡이 파파게노는 요술종을 받아 악당의 소굴로 향한다. 하지만 그 곳에서 밤의 여왕의 말과는 달리 자라스트로가 의로운 철학자라는 사실이 밝혀지고 타미노는 그 일원이 되기 위해 여러 시련을 거치기로 약속한다. 파파게노와 함께 감옥을 탈출한 파미나는 마침내 타미노를 만나지만 침묵 수행 중인 그가 말을 하지 않자 버림받았다고 오해를 하게 되는데..."
마왕의 딸 이리샤,애니메이션,83분,2019 .09.26 개봉,장형윤,"천우희(이리샤 목소리), 심희섭(개구리 목소리)",전체 관람가,"마법으로 기억을 잃은 채 평범한 고등학생으로 살아가던 ‘이리샤’는
 친구 ‘진석’의 빼앗긴 영혼을 되찾기 위해 우연히 요정 세계로 떠난다.
 그곳에서 비밀스러운 ‘개구리’, 기타 요정 ‘로비’를 만나고,
 가짜 마왕으로 인해 요정 세계가 위험에 빠졌다는 사실을 알게 되는데…
 
 현실과 요정 세계를 넘나드는 신비로운 모험이 시작된다!"
마음의 저편,멜로/로맨스,107분,2019 .02.17 개봉,프란시스 포드 코폴라,"프레드릭 포레스트, 테리 가, 라울 줄리아",청소년 관람불가,고물상을 하는 행크와 여행사를 하는 프래니. 이 둘은 5년 간을 같이 살아온 사이로 갑갑하고 지루한 일상을 탈피하고 싶어하지만 그것도 마음뿐 현실에서는 그 소망을 포기한 채 살아간다. 그렇게 살아오면서 어느덧 서로에 대한 애정도 식고 이들은 마침내 큰 말싸움 끝에 헤어진다. 프래니는 라스베가스의 식당에서 피아노를 치며 노래를 부르는 레이를 만나 그 동안 자신이 꿈꿔왔던 여행을 계획한다. 행크 역시 서커스를 하는 라일라를 만나 사랑을 나누지만 행크의 머리 속에서는 프래니가 떠나가질 않는다. 자신이 진실로 사랑하는 여자는 프래니임을 깨달은 행크는 레이와 함께 있는 프래니를 강제로 끌고 나오지만 프래니의 결심은 굳은 듯 보인다. 행크는 포기하지 않고 레이와 함께 떠나려는 프래니를 공항까지 따라가 설득해 보지만 프래니는 이를 외면하고 결국은 떠난다. 혼자 집으로 돌아온 행크는 낙심하여 프래니의 물건을 태우려 하는데 그 순간 프래니가 집으로 돌아온다.
마이펫의 이중생활2,"애니메이션, 모험, 코미디",85분,2019 .07.31 개봉,크리스 리노드,"패튼 오스왈트(맥스 목소리), 케빈 하트(스노우볼 목소리), 제니 슬레이트(기젯 목소리)",전체 관람가,"집을 비우면 다시 시작되는 펫들의 시크릿 라이프!
 집구석 걱정에 하루도 편할 날이 없는 ‘맥스’
 캣닢을 사랑하는 자유로운 영혼 ‘클로이’
 슈퍼히어로를 따라 하는 토끼 ‘스노우볼’
 완벽하게 고양이가 되고픈 강아지 ‘기젯’까지
 아직도 나만 몰랐던 마이펫들의 속마음이 공개된다!
 
 “우릴 키운다고? 그건 니 생각이고~”"
마지막 8월 어느 기념비의 이야기,다큐멘터리,101분,2019 .02.21 개봉,에두와르도 엘 산체스,다니엘 아라오즈,전체 관람가,"8월에 생을 마감한 미리엄과 연인 라울 남작. 그들의 진실을 찾아서
 감독은 과거 유명한 여배우이자 모험가이자 비행사였던 미리엄 스태포트를 기리는 기념비가 가진 의미와 기원에 대해 조사를 한다.
 많은 인터뷰와 과거 기록을 찾아 나가면서 당대의 뛰어난 작가이자 정치가인 라울 남작과 미리엄의 이야기를 알게 된다.
 1960년대 아르헨티나의 격동하는 정치적 소용돌이 속에서 두 사람의 운명적인 사랑이야기일 것이라는 예상과 달리 기념비에 얽힌 미스터리한 얘기들이 드러나기 시작한다.
 아르헨티나 최초의 여류 비행사를 죽음에 이르게 한 비극적 비행기 추락 사고는 정말 사고였을까?
 미리엄과 함께 사망한 남자 비행사와의 관계는 단순한 동료였을까?
 두 남녀 비행사의 관계를 라울 남작과 주변 사람들은 오해하고 있었을까?
 라울 남작이 죽음을 선택한 극단적인 이유는 무엇일까?
 그리고 무엇보다……두 사람의 사랑은 영원했을까?"
마지막 전투,"전쟁, 액션",81분,2019 .01.10 개봉,"션 크로닌, 록 솔트","션 크로닌, 조 스톤-피윙스, 리처드 디 로버츠",15세 관람가,"집에 돌아갈 준비를 하던 군인들은
 우왕좌왕하고 공격을 보이콧하지만
 이미 전투는 시작되고 가장 치열하고
 가장 어리석은 단 1시간의 전투는
 11,000명이 희생되는 비극이 된다.
 역사상 가장 무모한 전쟁을 목격한다."
말모이,드라마,135분,2019 .01.09 개봉,엄유나,"유해진(김판수), 윤계상(류정환)",12세 관람가,"1940년대 우리말이 점점 사라져가고 있는 경성.
 극장에서 해고된 후 아들 학비 때문에 가방을 훔치다 실패한 판수.
 하필 면접 보러 간 조선어학회 대표가 가방 주인 정환이다.
 사전 만드는데 전과자에다 까막눈이라니!
 그러나 판수를 반기는 회원들에 밀려 정환은 읽고 쓰기를 떼는 조건으로 그를 받아들인다.
 돈도 아닌 말을 대체 왜 모으나 싶었던 판수는 난생처음 글을 읽으며 우리말의 소중함에 눈뜨고,
 정환 또한 전국의 말을 모으는 ‘말모이’에 힘을 보태는 판수를 통해 ‘우리’의 소중함에 눈뜬다.
 얼마 남지 않은 시간, 바짝 조여오는 일제의 감시를 피해 ‘말모이’를 끝내야 하는데…
 
 우리말이 금지된 시대, 말과 마음이 모여 사전이 되다"
맛색녀의 성적유희,멜로/로맨스,89분,2019 .02.07 개봉,히데오 조조,코가와 이오리,청소년 관람불가,"문학 교사인 노부코는 엄격한 어머니와 함께 살며 자신의 욕망을 숨기고 있다.
 어느 날, 학교에서 괴롭힘 당하는 남학생 우치야마가 자신의 사진을 보며 자위하는 모습을 발견한 노부코는 그를 이용하여 장난을 치기로 한다.
 삽입 없이 불장난을 즐기는 우치야마와 노부코. 결국 왕따 때문에 학교를 쉬게 된 우치야마와 만난 노부코는 마지막으로 우치야마와 섹스를 한 뒤, 진짜 자신을 찾기로 한다."
맛있는엄마들,"에로, 멜로/로맨스",83분,2019 .09.27 개봉,이철,이은미,청소년 관람불가,"아내와 헤어지고 아들 희수와 단둘이 살고 있는 고지식 하지만 외로움을 이기지 못한 지식은 아들인 희수에게 새엄마를 들이면 어떠냐고 제안을 한다. 그리고 지식은 얼마 안돼 열정을 희수의 새엄마로 들인다. 한편 고 지식은 열정 과 아들만을 두고 출장을 가게된다.
 새엄마와 단둘이 남게 된 희수는 속옷이 다 보이는 야한 슬립을 입고 과일을 가지고 들어온 새엄마 열정의 빵빵 한 가슴과 탐스러운 허리와 엉덩이를 보고는 야한 상상을 하게 되고. 열정은 무료함에 아이들을 호주로 보내고 혼자 지내는 친구 순정을 집으로 부르는데. 순정은 화끈한 성격에 쭉쭉 빵빵 몸매로 영계만 보면 주체를 못하는 타입이다. 희수는 우연히 탐스러운 몸매의 순정의 샤워 장면을 목격하고는 순정을 탐하는 상상을 하게 되는데.
 그날 밤 그날 저녁 열정, 순정과 함께 술을 먹던 희수는 과연 꿈에 그리던 그녀들과의 섹스에 성공할 수 있을까?"
매니페스토,드라마,95분,2019 .07.25 개봉,율리안 로제펠트,케이트 블란쳇,15세 관람가,다다이즘부터 누벨바그까지 1인 13역 케이트 블란쳇을 통해 표현되는 예술 선언들
매리,"공포, 스릴러",85분,2019 .12.11 개봉,마이클 고이,"게리 올드만(데이비드), 에밀리 모티머(사라)",15세 관람가,"관광객을 대상으로 레저 투어업을 하는 ‘데이비드’(게리 올드만)는 무언가에 홀린 듯
 딸과 같은 이름을 가진 ‘매리’라는 배 한 척을 사게 된다.
 어딘가 미심쩍어 하는 아내 ‘사라’(에밀리 모티머)와 달리, 그는 설레는 마음을 안은 채
 두 딸과 선원들을 태워 첫 항해에 나서는데…
 승선한 이들은 점점 기묘한 말과 행동을 하기 시작하고,
 매리 호에 얽힌 숨겨진 진실들이 점차 드러나면서
 이 가족의 목숨을 위협하는 정체와 맞닥뜨리게 된다.
 
 “이 배에 다른 존재가 있는 것 같아!”"
모험왕 블링키,"애니메이션, 모험, 가족",78분,2019 .02.20 개봉,딘 테일러,"이선(블링키 한국어 목소리), 사문영(넛찌 한국어 목소리), 장민혁(잭코 한국어 목소리)",전체 관람가,"아빠처럼 용감한 탐험가가 되고 싶은 꼬마 코알라 ‘블링키’는
 그린패치 동물마을을 도마뱀 왕국으로 만들겠다는 ‘크랭키’를 막기 위해
 전설 속 ‘하얀 용의 바다’로 간 아빠를 찾아 모험을 떠난다.
 
 ‘블링키’는 혼자 떠난 여행길에서
 바깥 세상보다 동물원이 더 좋은 코알라 ‘넛찌’,
 소심한 겁쟁이 목도리 도마뱀 ‘잭코’와 만나 친구가 되는데…
 
 친구가 된 셋은 과연 ‘하얀 용의 바다’를 건너
 아빠를 무사히 찾아갈 수 있을까?"
몬스터 가디언즈,"액션, SF",85분,2019 .03.12 개봉,다니엘 와이즈,"에바레나 마리, 톰 시즈모어, 릭 라바넬로",청소년 관람불가,"1735년 뉴저지, 13번째 아들의 13번째 자녀로 야수 쌍둥이 남매가 태어난다.
 괴수의 모습으로 태어나 이름조차 없는 오빠와 인간의 모습이지만 꼬리가 달린 여동생 지브.
 그들은 300년 동안 늙지도 죽지도 않고, ‘수호자’라고 불리는 인간의 통제를 받으며 노예처럼 살아 오다가 이윽고 인류와의 전면전을 선포한다.
 이에 인간에 대한 살상을 막고자 하는 수호자들과 자유를 찾으려는 야수 남매의 운명을 건 거대한 전쟁이 펼쳐진다."
몬스터 랜드,"애니메이션, 판타지",74분,2019 .05.16 개봉,"아르튀르 드 팽, 알렉시스 두코드","이창민, 고구인, 박성영",전체 관람가,"좀비, 뱀파이어, 유령, 늑대인간, 마녀 등 다양한 괴물들을 고용하여 운영중인 ‘몬스터 랜드’에 어느날 안전 담당 공무원 엑토르가 나타나 규정을 어겼다며 경영난을 겪고 있는 이곳을 폐쇄하려 하자, 뱀파이어 매니저 프랑시스는 그를 좀비로 만든다.
 졸지에 외동 딸 루시와 생이별을 하게 된 엑토르는 다시 딸과 만날 수 있을까?"
