title,genre,running_time,release_date,director,actor,rating,summary
0.0MHz,공포,102분,2019 .05.29 개봉,유선동,"정은지(소희), 이성열(상엽), 최윤영(윤정)",15세 관람가,"에디슨의 마지막 발명품, 유령 탐지기?
 “증명할 수 없는 미스터리란 없다”
 가지 말라는 곳에 가야 하는 이유가 있다
 
 세상에 일어나는 초자연 미스터리를 분석하는 동아리 0.0MHz 멤버들이 귀신을 부르는 주파수를 증명하기 위해 우하리의 한 흉가를 찾은 후 기이한 현상이 멈추지 않는데…"
1 더하기 3,멜로/로맨스,101분,2019 .12.12 개봉,프룻 첸,증미혜자,청소년 관람불가,"멈추지 않는 성욕과 사랑하는 세 명의 남편을 위해,
 선상에서 밤낮 없이 몸을 파는 여인 무이.
 결코 마르지 않은 그녀의 샘,
 그리고 이를 탐한 세 남자의 운명은 과연 어디로 흘러갈까?"
10 미니츠 곤,"액션, 범죄",96분,2019 .11.21 개봉,브라이언 A 밀러,"브루스 윌리스, 마이클 치클리스",15세 관람가,"동물적인 직감과 1초의 오차도 용납하지 않는 설계자 ‘렉스’
 철저한 계획 하에 움직이는 기술자 ‘프랭크’와 멤버들은
 은행을 털지만 비상벨이 울리고 경찰과 시가전을 벌이고
 프랭크는 의문의 공격으로 기억을 잃는데…
 룰이 깨지고 모든 멤버들이 타겟이 된다.
 지워진 10분, 사건이 재구성된다!
 
 사라진 돈의 전쟁이 시작된다!"
100일 동안 100가지로 100퍼센트 행복찾기,코미디,111분,2019 .09.12 개봉,플로리안 데이비드 핏츠,"플로리안 데이비드 핏츠(폴), 마치아스 슈와바이어퍼(토니)",15세 관람가,"어렸을 적부터 함께 자라고, IT 회사도 공동 운영,
 사는 집도 아랫집, 윗집으로 이웃사촌인 ‘폴’과 ‘토니’는 둘도 없는 X랄 친구!
 
 스마트폰과 아마존 없이는 못 사는 #소비킹 ‘폴’과
 자신감과 발모약 없이는 못 사는 #자기관리킹 ‘토니’가
 1,400만 유로라는 빅딜 성사 후의 축하 파티에서
 거하게 취해 신경전을 벌이다가 홧김에 황당한 내기를 하게 된다.
 
 모든 것을 버린 후, 하루에 한 가지 물건을 돌려받으며
 100일을 버텨야 하는 ‘100일 챌린지’를 하게 된 ‘폴’과 ‘토니’!
 
 극과 극 성격, X랄 친구들의
 죽자고 덤비는 기상천외 100일 챌린지가 시작된다!"
10년,드라마,99분,2019 .12.12 개봉,"하야카와 치에, 키노시타 유스케, 츠노 메구미","스기사키 하나, 쿠니무라 준, 이케와키 치즈루",전체 관람가,"안락사, 인공지능과 완전히 통제된 교육,
 디지털 유산과 알 권리, 환경오염, 전쟁을 비롯해
 이미 우리의 이야기일 수도,
 혹은 우리의 이야기가 될 수도 있는 세상
 
 고레에다 히로카즈 감독 & 신예 5인 감독이 함께 만든
 냉철하지만 그 안에 따뜻함이 숨어있는 다섯 개의 시선에 관한 이야기"
12번째 솔저,전쟁,135분,2019 .04.11 개봉,해럴드 즈워트,"토마스 갈라스타드(얀 볼스루드), 조나단 리스 마이어스(커트 스테이지)",12세 관람가,"제2차 세계대전 나치에 점령된 노르웨이.
 나치를 함락시킬 유일한 ‘마틴 레드 작전’에 노르웨이 저항군 12명이 투입된다.
 하지만 작전 도중 발각되어 이들 중 11명은 체포되고
 단 1명, '얀'만이 총상을 입은 채 탈출에 성공한다.
 혹독한 추위와 험난한 설산 속에서
 냉혈한 나치 친위대 쿠르트 슈타게는 집요하게 추격해오는데…"
13년의 공백,"드라마, 가족",71분,2019 .07.04 개봉,사이토 타쿠미,"타카하시 잇세이(마츠다 코지), 릴리 프랭키(마츠다 마사토), 사이토 타쿠미(마츠다 요시유키)",12세 관람가,"담배를 사러 다녀 오겠다는 아버지는 그렇게 돌아오지 않았다.
 엄마는 아버지 대신 일을 나가고, 형은 엄마 대신 내 도시락을 준비했다.
 원망과 그리움이 한 데 섞인 13년이 흐른 지금,
 아버지와의 틈을 메우지 못한 채 아주 오랜만에 그를 마주한다."
1919 유관순,다큐멘터리,79분,2019 .03.14 개봉,신상민,"이새봄(유관순), 양윤희(어윤희), 김나니(권애라)",12세 관람가,"100년 전, 소녀들이 대한독립을 위해 세상에 맞서기 시작했다.
 우리가 기억해야 할 그 시절 모든 소녀들의 이름,
 그녀들이 남긴 그날의 가장 생생한 기록!"
2047 버추얼 레볼루션,"SF, 액션",92분,2019 .10.03 개봉,가이-로저 듀버트,"마이크 도퍼드(내쉬), 제인 배들러(디나), 요헨 해겔(스틸슨)",15세 관람가,"가상현실 기술의 발달로 환상과 현실이 혼합된 근 미래의 유럽.
 어느 날, 사이버 세계 속에서 한 테러조직에 의한 살인사건이 발생하고, 가상과 현실의 구분 없이 살고 있는 사설탐정 ‘내쉬’는 이 테러조직을 추격하기로 한다.
 온라인 가상의 세계와 현실을 오가며 테러리스트를 쫓기 시작하고, 이는 되돌릴 수 없는 결과를 불러오는데…
 
 이 곳에서 상상할 수 있는 모든 액션이 뒤집힌다!"
47미터 2,"공포, 스릴러",90분,2019 .08.28 개봉,요하네스 로버츠,"소피 넬리스(미아), 시스틴 로즈 스탤론(니콜), 브리안느 쥬(알렉사)",15세 관람가,"물에 잠긴 고대 마야의 수중도시 '시발바'를 향해
 짜릿한 동굴 다이빙에 나선 '미아'와 친구들은
 예기치 못한 사고로 미로 같은 동굴 속에 갇혀 헤매던 중
 오랜 시간 굶주린 블라인드 샤크와 맞닥뜨리게 된다.
 
 산소도, 탈출구도 없는 칠흑 같은 어둠 속에 갇힌 이들은
 눈 보다 예민한 제3의 감각으로 좁혀오는 상어떼를 피해
 목숨을 건 극한의 숨바꼭질을 시작하는데.."
48시간: 지구 최후의 날,코미디,97분,2019 .08.01 개봉,알렉산더 보이코브,알렉세이 드미트리에브,15세 관람가,"어느 날 갑자기 세상이 사라졌다! 하루아침에 모두 붕괴되어 버린 건물들과 사라져버린 사람들.
 원인을 추적하던 일당은 이 일이 참사 전 탈옥한 죄수들과 관련되어 있음을 알게 된다.
 이제 세상을 구하기 위해 48시간 안에 발전소 테러와 미사일 발사 계획을 반드시 막아야만 한다!"
6솔져스,"액션, 전쟁",105분,2019 .05.16 개봉,M. 차가타이 토순,케렘 버신,15세 관람가,"터키 국경 지역에서 잔악무도한 테러 단체가 판치는 가운데, 알파슬란 대위가 이끄는 특수부대가 아군을 돕기 위해 진격에 나선다.
 하지만 알파슬란의 절친한 동료이자 공군 소속 오누르 대위가 공습 도중 실종된다.
 이에 알파슬란의 6명 특수 부대원은 테러범보다 먼저 오누르 대위를 찾기 위해, 그리고 조국을 지키기 위한 마지막 방어선을 지키기 위해 목숨을 바친 위험한 전쟁을 시작하는데...!
 어떤 상황에서도 끝까지 전진한다! 거대한 테러에 맞선 위대한 전쟁을 확인하라!"
7 솔져스,"액션, 드라마, 전쟁",110분,2019 .09.19 개봉,다미안 뵈르그,디나 샤하비,청소년 관람불가,"군인들이 어떻게 생활하는지, 그들의 인간적인 모습을 알리고 싶어서 미군부대를 따라 아프간 전쟁에 취재 나온 젊은 종군기자 샘 그레이디.
 군인들도 가족과 감정이 있는 똑같은 사람이라는 걸 깨닫게 된다.
 팀을 따라 도보 순찰을 나갔다가 갑자기 탈레반군을 만나게 되고 황급히 벙커를 찾아 숨는다.
 물도 음식도 없는 벙커에서 버티던 중, 폭탄을 찬 아프간 여자가 벙커에 들어온다.
 여자는 폭탄을 터뜨리지 않았고, 순순히 잡혀 의자에 묶인다.
 미군들이 전쟁터에 두고 온 동료들을 구하러 나간 후 샘은 벙커에 여자와 단둘이 남겨지는데..."
82년생 김지영,드라마,118분,2019 .10.23 개봉,김도영,"정유미(지영), 공유(대현)",12세 관람가,"1982년 봄에 태어나
 누군가의 딸이자 아내, 동료이자 엄마로
 2019년 오늘을 살아가는 ‘지영’(정유미).
 때론 어딘가 갇힌 듯 답답하기도 하지만
 남편 ‘대현’(공유)과 사랑스러운 딸,
 그리고 자주 만나지 못해도 항상 든든한 가족들이 ‘지영’에겐 큰 힘이다.
 
 하지만 언젠가부터 마치 다른 사람이 된 것처럼 말하는 ‘지영’.
 ‘대현’은 아내가 상처 입을까 두려워 그 사실을 털어놓지 못하고
 ‘지영’은 이런 ‘대현’에게 언제나 “괜찮다”라며 웃어 보이기만 하는데…
 
 모두가 알지만 아무도 몰랐던
 당신과 나의 이야기"
8년 전쟁: 이란 vs 이라크,"액션, 전쟁",96분,2019 .04.25 개봉,모하메드 호세인 마흐다비안,하디 헤자지파르,15세 관람가,8년간 이어진 이란-이라크 전쟁의 영웅 아흐마드 모테바젤. 지휘관이자 혁명가인 그는 폭탄이 떨어지는 전쟁 한복판에서 군 사령관으로서의 출중한 능력뿐만 아니라 소외된 사람들까지 챙기며 모두의 신임을 얻는다. 이 기나긴 전쟁을 끝나기 위해 아흐마드는 절대 포기 하지 않는다!
EBS 댄스파티!,가족,40분,2019 .10.16 개봉,박상용,"서홍석(번개맨), 정승민(번개걸), 최오식(나잘난)",전체 관람가,"번개맨, 번개걸, 뿡뿡이, 뿡순이, 뚜앙 등 EBS 캐릭터들이 최초로 한 자리에 총 출동!
 극장형 어린이 OST 싱어롱 콘서트!
 레인보우 댄스파티에 어린이 여러분을 초대합니다!"
가버나움,드라마,126분,2019 .01.24 개봉,나딘 라바키,"자인 알 라피아(자인), 요르다노스 시프로우(라힐)",15세 관람가,"나를 세상에 태어나게 한
 ""부모님을 고소하고 싶어요...""
 -출생기록조차 없이 살아온 어쩌면 12살 소년 '자인'으로부터"
갈까부다,다큐멘터리,76분,2019 .09.01 개봉,고봉수,"최은비(은비), 고봉수(봉수), 김정기(조연출)",12세 관람가,"43살 영화감독 고봉수는 자신보다 18살 어린 여자친구 최은비를 위해 국악 다큐멘터리를 기획한다.
 지금까지 여자친구에게 제대로 된 선물을 한 적이 없던 고봉수는 여자친구가 크게 감동 할 것이라 생각해 야심차게 준비하지만 다큐멘터리 제작을 위해 여자친구의 친구들과 가족들을 인터뷰를 하는 과정에서 온갖 욕과 모욕적인 말을 듣게 되고 극심한 반대에 부딪힌다.
 
 좌절한 고봉수는 최은비의 아버지를 자신의 편으로 만들면 모든 것이 해결될 것이라 생각해 최은비의 아버지를 찾아가지만 되려 최은비의 아버지는 고봉수를 구타하며 크게 분노한다.
 자신과 여자친구의 가족들 뿐 아니라 주변 모든 지인들이 반대를 하는 연애.
 결국 둘은 반대에 지쳐 헤어지게 된다.
 고봉수는 마지막 선물로써 여자친구의 국악 다큐멘터리를 완성시킨다."
감쪽같은 그녀,드라마,104분,2019 .12.04 개봉,허인무,"나문희(말순), 김수안(공주)",전체 관람가,"“초면에 실례하겠습니다~”
 72살 나 홀로 라이프를 즐기는 ‘말순’ 할매의 인생에
 듣도 보도 못한 손녀(?)가 나타났다!
 
 특기는 자수, 용돈 벌이는 그림 맞추기(?)
 동네를 주름 잡으며 나 혼자 잘 살고 있던 ‘말순’ 할매 앞에
 다짜고짜 자신을 손녀라고 소개하는 열두 살 ‘공주’가
 갓난 동생 ‘진주’까지 업고 찾아온다.
 
 외모, 성격, 취향까지 모든 것이 극과 극인 ‘말순’과 ‘공주’는
 티격태격 하루도 조용할 날 없이 지내지만,
 필요한 순간엔 든든한 내 편이 되어주며 서로에게 특별한 존재가 되어간다.
 하지만 ‘말순’은 시간이 갈수록 ‘공주’와의 동거생활이
 아득하고 깜깜하게만 느껴지는데…"
강남 며느리,"멜로/로맨스, 드라마",98분,2019 .10.11 개봉,이상수,"새봄, 수빈",청소년 관람불가,"가난에서 벗어나 강남에서 살고싶은 아영은 중년의 부자인 만수를 우연히 만난다.
 만수의 권유로 그의 아들 태민을 만나 연애를 하게 된 아영은 혼자 살던 집이 전세계약 만료가 되자,
 태민과 결혼하기 전에 몇 달 동안만 만수, 태민이 사는 강남 집에서 같이 살게 된다.
 하지만, 점차 아영은 무능하고 폭력적인 성격의 아들 태민보다는 자신을 진정으로 아껴주는 만수에게 매력을 느끼기 시작하는데..."
강변호텔,드라마,95분,2019 .03.27 개봉,홍상수,기주봉(영환),15세 관람가,"강변의 호텔에 공짜로 묵고 있는 시인이 오랫동안 안 본 두 아들을 부른다.
 아무 이유없이 죽을 거 같다는 느낌이 들어서 부른 거다.
 한 젊은 여자가 같이 살던 남자에게 배신을 당한 후 강변의 호텔에 방을 잡았다.
 위로를 받으려 선배 언니를 부른다.
 다들 사는 게 힘들다.
 그 강변의 호텔에서 하루는 하루가 다인 양 하루 안에서 계속 시작하고 있고, 사람들은 서로를 바라만 보고 있다."
고질라: 킹 오브 몬스터,"액션, 모험, SF",132분,2019 .05.29 개봉,마이클 도허티,"밀리 바비 브라운(매디슨 러셀), 베라 파미가(엠마 러셀), 카일 챈들러(마크 러셀)",12세 관람가,"고질라의 샌프란시스코 공격으로 인해 아들을 잃은 상처로 엠마와 마크, 딸 매디슨 가족은 슬픔 속에 살고 있다.
 미지의 생물을 연구하는 모나크 소속 과학자인 엠마는
 또 다른 공격에 대비해 거대 괴수와 소통하는 주파수를 발견한다.
 그러나 괴수들을 조종해 지구를 초토화 시키려는 테러 세력에게 딸 매디슨과 납치되고,
 주파수로 모스라, 로단, 기도라 등 고대 괴수들이 하나 둘 깨어난다.
 역대급 재난 상황에서 인류의 생존 자체조차 불투명해지고,
 여기에 강력한 고질라의 등장으로 괴수들의 대결은 새로운 국면을 맞이한다.
 또 다시 최악의 위기를 맞은 가족들은 어떻게든 함께 위험을 헤쳐나가야만 하는데..."
"고흐, 영원의 문에서",드라마,111분,2019 .12.26 개봉,줄리안 슈나벨,"윌렘 대포(빈센트 반 고흐), 오스카 아이삭(폴 고갱), 매즈 미켈슨(사제)",12세 관람가,"가난과 외로움 속에 살던 화가 빈센트 반 고흐는 운명의 친구 폴 고갱을 만난다
 그 마저도 자신을 떠나자 깊은 슬픔에 빠지지만 신이 준 선물,
 자연의 아름다움을 담기 위해 몰두한다.
 
 불멸의 걸작이 탄생한 프랑스 아를에서부터 오베르 쉬르 우아즈까지....
 빈센트 반 고흐의 눈부신 마지막 나날을 담은 기록"
공포의 묘지,"스릴러, 공포",101분,2019 .04.10 개봉,"케빈 콜쉬, 데니스 위드미어","제이슨 클락(루이스 크리드), 존 리스고(주드 크랜들), 에이미 세이메츠(레이첼 크리드)",15세 관람가,"갑작스런 사고로 딸 엘리를 잃은 크리드(제이슨 클락)는 죽은 것이 살아 돌아온다는 애완동물 공동묘지에 딸을 묻게 되고, 어딘가 다른 모습으로 돌아온 엘리는 무시무시한 공포의 대상이 되어 가족들의 숨통을 조여오는데……"
공포의 묘지: 망자의 저주,공포,99분,2019 .12.23 개봉,레베카 매튜스,"제시카 오툴, 데이비드 코터, 리타 시디퀴",15세 관람가,제프는 사람들을 모아 저승의 경계에 가서 죽은 사람을 다시 만나는 망자의식을 시도한다. 무사히 끝난 것 같던 의식. 하지만 그 날 이후 망자들이 나타나 이들의 목숨을 위협한다. 이제 깨어난 망자의 위험한 저주가 시작된다.
그녀들을 도와줘,코미디,90분,2019 .07.25 개봉,앤드류 부잘스키,"레지나 홀(리사), 헤일리 루 리차드슨(마시)",15세 관람가,"오늘도 엉망이지만,
 눈물을 닦고 ‘더블 웨미’로 출근한 리사.
 탱크톱을 입고 음식을 서빙하는 스포츠 바 ‘더블 웨미’에는
 언제나처럼 매니저 리사를 기다리는 일들이 쌓여있다.
 
 천장에는 도둑이 갇혀있고, 케이블 TV는 안 나오고,
 에어컨은 또 고장이 났고, 직원들은 돌아가며 말썽이다.
 
 하나같이 내 맘대로 되는 게 없는 오늘,
 사정을 알 리 없는 사장에 맞서 직원들을 챙겨주다
 갑자기 해고 통보를 받게 되는데…
 
 인생이 뜻대로 되지 않을 때,
 그래도 계속 웃게 되는 건 바로 웨미 걸즈 덕분!
 힘껏 소리치는 그녀들과 함께, 씩씩하게 다시 WAY TO GO!"
그녀의 섹스테크닉,멜로/로맨스,70분,2019 .02.07 개봉,레이 사카모토,니시야마 마키,청소년 관람불가,"지진으로 인해 40년 가까이 정신병원에서 지냈던 나가노는 환갑이 된 나이에 병원을 나와 후두암 판정을 받고 말을 할 수 없게 된다.
 세상에 나오게 된 나가노는 고등학교 시절 자신이 돈을 주고 첫 경험을 했던 첫사랑 사치코를 찾기 위해 동경으로 떠나려 한다.
 자전거를 타고 동경에 가려던 나가노는 접촉 사고로 한 여자와 우연히 만나게 되고 후두암으로 아버지를 잃게 된 아픔을 지닌 이 여자와 관계를 갖게 되는데..."
그대 이름은 장미,코미디,126분,2019 .01.16 개봉,조석현,"유호정(장미), 박성웅(명환), 오정세(순철)",12세 관람가,"딸에겐 잔소리 1등, 딸을 위해선 오지랖 1등, 대한민국 평범한 엄마 ‘홍장미’씨
 우연한 사고로 과거의 남자 ‘명환’을 만나며 평온했던 일상이 꼬여만 가고,
 설상가상으로 그녀의 대단했던(?) 과거까지 들통날 위기에 처한다
 여기에 20년 남사친 ‘순철’까지 끼어들어 강제과거소환을 막으려 애를 쓰기 시작하는데…
 
 평범한 엄마 ‘홍장미’ 씨!
 그녀의 믿을 수 없는 반전과거는 영원한 비밀이 될 수 있을까?!"
그때 그들,"드라마, 코미디",157분,2019 .03.07 개봉,파올로 소렌티노,"토니 세르빌로(실비오 베를루스코니), 리카르도 스카마르치오(세르조 모라), 엘레나 소피아 리치(베로니카 라리오)",청소년 관람불가,"재계 서열 1위, 미디어 장악, AC밀란 전 구단주, 망언 제조기까지.
 이탈리아를 현혹시킨 최악의 이슈 메이커 실비오 베를루스코니는 정치 스캔들에 연루돼 총리직에서 사퇴한 뒤,
 재기를 위한 발판을 마련하기 위해 개인 별장에 머무른다.
 연예 기획자 세르조 모라는 실비오 베를루스코니의 권력을 통해 인생 역전을 꿈꾸며 그에게 접근한다.
 성공을 향한 욕망으로 뒤틀린 두 남자는 자신의 목적을 이루기 위해 수단과 방법을 가리지 않고 폭주하는데...."
그레이브 하우스,"드라마, 스릴러, 공포",82분,2019 .03.12 개봉,안톤 시규르드손,"비욘 흘리뉘르 하랄드손, 엘바 마리아 비르기스도티르, 마르그레트 아스타",15세 관람가,"재력과 사랑, 예쁜 딸까지 남부러울 것 없던 구나와 손야 부부.
 어느 날, 딸이 죽고 회사까지 파산하며 그들의 세계는 무너진다.
 부부는 새로운 시작을 위해 아이슬란드 시골의 외딴 저택으로 잠시 휴가를 떠났다가 페를라라는 소녀를 입양한다.
 평화로운 시간도 잠시, 남편 구나는 페를라를 둘러싸고 유령들이 나타나는 것을 감지하지만
 아내 손야는 페를라를 감싸기에 급급하고 구나를 미친 사람으로 몰아가는데…
 
 부부의 운명, 그리고 구나의 눈에만 보이는 유령들의 진실은 무엇인가!"
그린 북,드라마,130분,2019 .01.09 개봉,피터 패럴리,"비고 모텐슨(토니 발레롱가), 마허샬라 알리(돈 셜리 박사)",12세 관람가,"1962년 미국, 입담과 주먹만 믿고 살아가던 토니 발레롱가(비고 모텐슨)는 교양과 우아함 그 자체인
 천재 피아니스트 돈 셜리(마허샬라 알리) 박사의 운전기사 면접을 보게 된다.
 
 백악관에도 초청되는 등 미국 전역에서 콘서트 요청을 받으며 명성을 떨치고 있는 돈 셜리는
 위험하기로 소문난 미국 남부 투어 공연을 떠나기로 결심하고,
 투어 기간 동안 자신의 보디가드 겸 운전기사로 토니를 고용한다.
 
 거친 인생을 살아온 토니 발레롱가와 교양과 기품을 지키며 살아온 돈 셜리 박사.
 생각, 행동, 말투, 취향까지 달라도 너무 다른 두 사람은
 그들을 위한 여행안내서 ‘그린북’에 의존해 특별한 남부 투어를 시작하는데…"
그림자 킬러,스릴러,84분,2019 .01.17 개봉,앤드류 루모어,알란 헌팅턴,15세 관람가,"한 여성이 그림자처럼 숨어든 스토커에게 순식간에 살해당한다. 이후 죽음의 고속도로를 배경으로 펼쳐지는 공포의 에피소드가 차례로 소개 되어진다. 싸이코 살인마, 다중인격자의 정체, 원혼의 복수, 흡혈귀의 사냥터, 탈주범들의 배신 등의 다양한 소재들이 결국 공포의 하이웨이에서 펼쳐진다."
극장판 공룡메카드: 타이니소어의 섬,애니메이션,70분,2019 .01.10 개봉,"최신규, 유재운","김서영(트리케라 목소리), 엄상현(티라노 목소리), 안현서(나용찬 목소리)",전체 관람가,"머나먼 옛날, 소행성 충돌로 인해 지구의 공룡들이 모두 사라지고
 사람들에게 알려지지 않은 어느 작은 섬에서 공룡들은 아주 작은 모습의 타이니소어로 탄생한다.
 씩씩한 트리케라, 장난꾸러기 티라노, 잠꾸러기 스테고 등 타이니소어 친구들이
 도토리 축구를 하며 즐거운 나날을 보내고 있던 중,
 수상한 악당들이 나타나 평화로운 ‘타이니소어의 섬’을 위협하기 시작하는데…
 타이니소어들을 노리는 수상한 눈빛의 정체는?
 과연 이들은 위기에 처한 지상 낙원 ‘타이니소어의 섬’을 지켜낼 수 있을까?"
극장판 반지의 비밀일기,애니메이션,72분,2019 .09.11 개봉,한승우,"방연지(반지 목소리), 김선혜(응심 목소리), 조경이(냠냠 목소리)",전체 관람가,"요즘 비가 오는 날이면 방울 소리와 함께
 친구들이 하나 둘 씩 사라지기 시작했다.
 그런데… 우리 아빠도 사라졌다! ㅠ_ㅠ
 
 베프 ‘응심이’ ‘냠냠이’와 아빠를 찾던 그때,
 미스터리한 빵 장수가 나타나 순식간에 이상한 세계로 빨려 들어왔다!
 
 아이스크림 동산과 초콜릿 동굴이 있고
 슈크림 대마왕과 바게트 병사들이 지키는
 달콤하고 수상한 여기는 도대체 어디지!?"
극장판 샤이닝스타:새로운 루나퀸의 탄생!,애니메이션,77분,2019 .07.18 개봉,"박일호, 정지훈","정혜원(헤라 목소리), 이명호(나라 / 피치 목소리), 박리나(시아 / 로즈 / 제이 목소리)",전체 관람가,"세계 최고의 아이돌 학교 샤이닝스타 스쿨!
 데뷔반의 완성형 연습생 '헤라'와 노력형 연습생 '나라'는
 세계 최고의 아이돌 스타 타이틀 '루나퀸'이 되기 위한 오디션에 돌입한다.
 그러던 중 '헤라'는 자신이 속한 그룹 '돌스'에서 돌연 탈퇴하고
 ‘나라’가 속해 있는 그룹에 합류, 새로운 팀 '뉴 멜로디'가 결성된다.
 하지만 실력지상주의 이사장 '칼리오페'는 '헤라'에게 솔로로 루나퀸 결승 무대에 오르면
 단독 우승을 할 수 있다며 '뉴 멜로디'와 '헤라'를 갈라 놓으려 하고,
 ‘뉴 멜로디’의 우정이 흔들리기 시작 하는데…
 
 루나퀸과 우리의 우정 모두를 지킬 수 있을까!"
극장판 엉덩이 탐정: 화려한 사건 수첩,애니메이션,68분,2019 .07.11 개봉,히라야마 미호,"김은아(엉덩이탐정 목소리), 소연(브라운 목소리)",전체 관람가,"평화로운 오후의 찻집, 엉덩이 탐정과 조수 브라운이 티타임을 즐기고 있을 때,
 큰 쇼핑백을 든 뿌우람 씨가 들어온다.
 마을에 새롭게 오픈하는 카레 가게의 사장인 뿌우람 씨는
 카레 요리에 빠지면 안 되는 중요한 향신료 ‘알알살라’가 사라진 것을 알게 된다!
 “그게 없으면 카레를 만들 수 없어. 가게를 열 수 없어!”
 충격으로 쓰러진 뿌우람 씨를 보고 엉덩이 탐정이 일어난다.
 “저에게 맡겨 주십시오!”
 과연 엉덩이 탐정은 ‘화려한’ 추리로 사라진 향신료의 수수께끼에 다가설 수 있을까?
 
 <뿡뿡! 보라 부인의 암호 사건>도 함께 만나요!"
