title,genre,running_time,release_date,director,actor,rating,summary
쎈놈,액션,75분,2019 .04.11 개봉,김유진,"김도건(백동호), 윤경호(백동민), 왕우진(장우진)",청소년 관람불가,"10대들만의 불법 격투 도박장 ‘아레나’의 랭킹 1위 ‘동호’는 체대 진학을 위해 은퇴를 결심한다.
 하지만 ‘아레나’ 일원들은 큰 수입원인 ‘동호’를 놓치고 싶지 않다는 생각에 ‘동호’의 동생 ‘동민’을 도박장에 끌어들여 빚을 지게 만든다.
 빚에 떠밀려 어쩔 수 없이 격투에 참가했다가 크게 다친 ‘동민’. 그 모습을 보고 분노한 ‘동호’는 복수의 주먹을 빼든다."
쓰리 세컨즈,드라마,133분,2019 .06.20 개봉,안톤 메게르디체브,"블라디미르 마쉬코프(블라디미르), 키릴 자이체프(세르게이 벨로프), 이반 코레스니코프(알렉산더 벨로프)",12세 관람가,"1972년 뮌헨 올림픽 남자 농구 결승전. 36년간 우승을 차지한 최강자 미국을 반드시 꺾어야만 하는 소련 농구 대표팀은 한 치의 양보도 없는 불꽃 튀는 접전을 펼친다.
 예측 불가능한 결과에 숨막히는 긴장감이 이어지는 가운데, 소련의 타임아웃 요청을 듣지 못한 심판의 실수로 경기는 미국의 우승으로 종료된다.
 이에 소련 농구 대표팀은 격렬히 항의하고, 자신의 과오를 인정한 심판은 남은 시간을 3초를 선언하며 사상 유례 없는 재승부가 시작되는데..."
"아나, 내사랑","드라마, 멜로/로맨스",127분,2019 .01.17 개봉,칼린 피터 네처,"다이아나 카발리오티(아나), 미르세야 포스텔니쿠(토마)",청소년 관람불가,"대학생 아나와 토마는 첫눈에 사랑에 빠지고
 뜨거운 격정으로 서로를 탐닉한다.
 부모의 반대와 정신적 문제에도
 서로에게 더 깊이 들어가고 미친 듯이 중독되는데…
 
 지독한 격정에 빠져든다!"
아내 빌려주는 남자,멜로/로맨스,62분,2019 .08.09 개봉,나가에 타카미,야마모토 미와코,청소년 관람불가,"결혼 10년차, 완전히 섹스리스가 되어버린 부부. 남편은 자극을 추구하는 아내를 다른 남자에게 안겨주고 싶다는 욕망을 가지고 출장 호스트를 부르고, 처음엔 거부하던 아내였지만 호스트의 농후한 스킬에 섹스 돌입하기도 전에 이미 몸도 마음도 녹아내려 버린다"
아내를 죽였다,"스릴러, 액션",97분,2019 .12.11 개봉,김하라,"이시언(채정호), 안내상(최대연 경위), 왕지혜(정미영)",15세 관람가,"친구와 술을 마신 후 곯아떨어진 ‘정호’는 숙취로 눈을 뜬 다음 날 아침,
 별거 중이던 아내 ‘미영’이 살해당했다는 충격적인 소식을 듣게 된다.
 
 그 순간, 자신의 옷에 묻은 핏자국과 피 묻은 칼을 발견한 ‘정호’.
 가장 강력한 용의자로 지목된 그는 경찰의 눈을 피해 도망친다.
 
 알리바이를 입증하고 싶지만 간밤의 기억은 모두 사라진 상태.
 스스로를 믿을 수 없는 최악의 상황에서
 ‘정호’는 어젯밤의 행적을 따라가기 시작하는데…
 
 끊어진 기억과 기억 사이,
 사라진 모든 것을 의심하라."
아내와 내 친구들,멜로/로맨스,69분,2019 .12 개봉,최재후,"조완진, 민정, 지아",청소년 관람불가,"명호는 헬스장에서 함께 어울려 운동하는 친구 영석과 동수가 있다. 명호의 아내인 향이, 그리고 이혼녀인 수희도 이 헬스장에 함께 다닌다. 평소에 운동하고 있는 수희의 모습을 유심히 관찰하던 명호는 운동을 도와준다는 핑계로 그녀에가 다가간다. 한편, 영석과 동수는 명호의 아내인 향이의 몸매를 훔쳐보며 그녀에게 흑심을 품기 시작하는데..."
아빠친구2,멜로/로맨스,91분,2019 .01.04 개봉,감자,상우,청소년 관람불가,"아내와 10년 전 사별하고 어촌으로 내려와 살고있는 혁수에게 친구의 딸 세희가 갑작스럽게 찾아온다. 무료하던 혁수의 삶에 사슴처럼 뛰어든 세희의 출현에 혁수는 모처럼 웃음을 되찾는다. 하지만 세희와의 즐거운 한때를 보내던 것도 잠시. 세희의 전 남자친구 종진이 내려오고 둘은 섹스를 하게되는데 이런 모습을 본 혁수는 마음이 심난해 어찌 할 바를 모른다. 하지만 종진은 세희의 작은 바램과는 달리 이미 다른 여자가 생겼고 세희에게 사귈 때 맡겨 놓았던 통장을 받기 위해 잠시 내려온 것일 뿐이다. 세희는 종진의 사랑을 회복하기 위해 종진의 질투심을 유발하려고 혁수에게 애교를 부리며 유혹하지만 오히려 종진에게 이별의 합당한 명분만 주는데..종진의 목적이 통장 때문이란걸 알게된 세희는 실의에 빠진다. 이때, 세희를 따뜻하게 위로 해주는 혁수.
 종진 때문에 혁수를 이용했던 일을 진심으로 사죄하고 혁수는 그런 세희를 따뜻이 이해해 준다. 혁수와 세희는 진정으로 사랑의 감정을 갖게되지만 친구의 딸이라는 사실에 혁수는 세희를 받아들이지 못하고 괴로워 하던 중 만취한 세희는 알몸으로 잠든 혁수의 방으로 들이 닥치고 본능을 억제 하지 못하고 세희와 뜨거운 사랑을 나누게 된다."
아사코,드라마,120분,2019 .03.14 개봉,하마구치 류스케,"히가시데 마사히로(바쿠 / 료헤이), 카라타 에리카(아사코)",12세 관람가,"I. 강렬했다. 누구에게나 처음이 그렇듯…
 첫사랑 ‘바쿠’와 함께하는 모든 날이 특별했던 ‘아사코’.
 설레지만 불안하고 뜨겁지만 자유로운 영혼이었던 바쿠는
 어느 날, 다시 돌아온다는 짧은 말만 남긴 채 아사코를 떠나갔다.
 
 II. 편안했다. 다시 시작할 수 있어서…
 우연일까? 운명일까?
 첫사랑 바쿠와 똑같은 외모의 ‘료헤이’를 만나게 된 아사코.
 겉모습만 같을 뿐 공통점 하나 없는 모습에 혼란스럽지만,
 자상하고 따뜻한 료헤이의 사랑으로
 아사코는 다시 설레는 사랑의 순간을 맞이한다.
 
 그러던 어느 날, 떠나간 첫사랑 바쿠가 갑자기 나타나고
 아사코는 흔들리기 시작한다."
아스테릭스: 마법 물약의 비밀,"애니메이션, 코미디, 가족, 판타지",75분,2019 .12.12 개봉,"알렉상드르 아스티에, 루이 클리시","크리스티앙 클라비에, 기욤 브리에",전체 관람가,"마을의 히어로 ‘아스테릭스’는 마시면 슈퍼 파워가 생기는
 마법 물약이 다 떨어지자 마법 물약의 레시피를 찾는 동시에
 대마법사의 후계자를 찾아 모험을 떠난다.
 아스테릭스는 모험에서 만난 꼬마 소녀 ‘펙틴’을 후계자로 점찍는데…
 한편, 악당 ‘데모닉스’ 역시 자신의 제자를 이용해
 마법 물약 레시피를 훔칠 계획을 세운다!
 
 과연 마법 물약 레시피를 만들 진짜 후계자는 누구~?"
아스트로: 우주전쟁,"SF, 액션, 드라마",104분,2019 .01.11 개봉,아시프 액크바,"루이스 맨다이어, 게리 다니엘스, 스파이스 윌리엄스-크로스비",15세 관람가,우주항공산업을 성공시키며 놀라운 기술의 발전을 이루어낸 억만장자 알렉산더. 그런데 우연히 발견한 외계 생명체에 무언가 비밀이 숨겨져 있음을 알고 특수부대 시절 동료였던 잭 아담스를 우주항공사로 초대해 도움을 청한다. 그리고 그들 앞에 드러나는 충격적인 진실! 그 무엇도 이제 믿을 수 없다.
아워 바디,드라마,95분,2019 .09.26 개봉,한가람,"최희서(자영), 안지혜(현주), 김정영(자영 모)",15세 관람가,"8년 차 행정고시생 자영.
 번번이 시험에 떨어지면서 공부와 삶에 모두 지쳐버린 그녀 앞에 달리는 여자 현주가 나타난다.
 현주처럼 되고 싶다는 욕망으로 생애 처음 달리기를 시작한 자영은 타인의 시선에서 자유로워지며 조금씩 삶의 활기를 찾아가는데..."
아이 엠 마더,"액션, 드라마, 스릴러",102분,2019 .04.11 개봉,피에르 모렐,제니퍼 가너(라일리 노스),15세 관람가,"평범한 주부 ‘라일리’(제니퍼 가너)는 딸의 10번째 생일날
 마약 조직원들의 총격에 눈앞에서 남편과 딸을 잃는다.
 충격에서 깨어난 ‘라일리’는 증인석에서 범인을 지목하지만, 부패한 판사는 이들을 풀어준다.
 
 5년 후, 총격 사건과 연관 있는 인물들이 하나 둘씩 살해당하고
 언론과 경찰은 거액의 돈과 함께 사라진 ‘라일리’를 범인으로 지목하는데…"
아이 엠 브리딩,다큐멘터리,74분,2019 .12.19 개봉,"엠마 데이비, 모라그 맥키넌","닐 플랫(본인), 루이즈 플랫(본인), 오스카 플랫(본인)",12세 관람가,"사랑하는 아내 루이즈의 남편이자
 갓 돌이 지난 오스카의 아빠 닐 플랫.
 
 평범한 30대 건축가였던 그에게 예기치 못한 소식이 날아들고,
 그로 인해 그와 가족의 일상에 큰 변화가 생긴다.
 
 닐은 온몸의 생생한 감각으로
 ‘화나고 끔찍하지만 재미있고 즐거운’이야기를 써내려 가며
 아들 오스카를 위한 특별한 도전에 나서는데…
 
 한 남자의 사랑과 우정, 그리고 인생을 통해
 우리 모두의 ‘생의 감각’을 일깨우는 감동실화!"
아이리시맨,"범죄, 드라마, 스릴러",209분,2019 .11.20 개봉,마틴 스코세이지,"로버트 드 니로(프랭크 시런), 알 파치노(지미 호파), 조 페시(러셀 버팔리노)",청소년 관람불가,"전후 미국에 드리운 범죄 조직의 그림자. 이제 한 거물 암살자가 입을 연다. 마틴 스코세이지 감독과 로버트 드 니로, 알 파치노, 조 페시가 선사하는 장대한 범죄 드라마."
아이스,"드라마, 뮤지컬, 멜로/로맨스",90분,2019 .02.07 개봉,올레그 트로핌,"알렉산더 페트로브(사샤), 아글라야 타라소바(나디아)",전체 관람가,"구부정한 몸, 휘어진 다리로 피겨요정을 꿈꾸던 어린 나디아,
 호랑이 코치 샤탈리나에게 극강의 훈련을 받아
 피겨스케이팅 간판 선수 레오노프의 파트너가 되어 정상에 오른다.
 그러나, 최고 권위의 피겨스케이팅 대회인 아이스컵 진출을 앞두고
 심각한 부상으로 휠체어 신세를 지게 된다.
 다시는 빙판 위에 설 수 없을지도 모른다는 좌절감에 빠진
 나디아에게 샤탈리나 코치는 재활파트너로 스타워즈밖에 모르는
 똘끼충만 아이스하키선수 사샤를 옆에 붙여주게 되는데…
 
 아슬아슬 빙판 위 달콤살벌 피겨스케이팅 커플 탄생?
 모두가 응원할 반짝이는 아이스쇼가 펼쳐진다!"
아이아이 가사: 다시 만난 그날,"가족, 드라마",117분,2019 .05.30 개봉,타쿠마 타카유키,"쿠라시나 카나(타카시마 사츠키), 이치하라 하야토(아마미야 세이타로), 타테카와 단슌(시노노메 로쿠로)",12세 관람가,"어느 날 갑자기 사라진 아버지를 찾아
 작은 시골 마을에 찾아온 '사츠키'.
 
 축제를 핑계로 우연히 만난 ‘세이타로’와 함께 마을을 둘러보던 도중,
 아버지와 그리고 미처 몰랐던 가족까지 마주하게 되는데..
 
 아버지에 대한 미움도, 추억도 어느덧 희미해졌지만
 자꾸만 보고 싶은 이야기가 옵니다."
아직 사랑하고 있습니까?,코미디,99분,2019 .12.04 개봉,신양중,"김인권(오영욱), 이나라(김연경), 서태화(장민식)",청소년 관람불가,"의리로 사는 10년 차 부부 ‘연경’과 ‘영욱’
 빨간 불 들어온 그들 사이에 색(!)다르게 사는 이들이 끼어들었다!
 
 본능대로 사는 남자 ‘민식’ & 즐기면서 사는 여자 ‘재순’ & 참지 않고 사는 여자 ‘혜인’
 ‘연경’과 ‘영욱’의 무미건조한 결혼 생활은 그들과의 짜릿한 일탈로 살(!) 맛을 찾아가는데…"
"안녕, 티라노: 영원히, 함께",애니메이션,98분,2019 .08.14 개봉,시즈노 코분,"시영준(티라노 목소리), 정혜원(프논 목소리), 이세은(톱스 목소리)",전체 관람가,"넌 이제, 혼자가 아니야
 가슴 아픈 비밀과 소중한 약속을 간직한 ‘티라노’와 ‘프논’이
 그들만의 천국을 찾아 떠나면서 펼쳐지는
 우정, 사랑 그리고 희망에 관한 이야기"
안도 타다오,다큐멘터리,73분,2019 .04.25 개봉,미즈노 시게노리,안도 다다오(본인),전체 관람가,"전문적인 건축교육을 받지 못했지만, 타고난 예술성과 도전정신으로 실력을 인정받은 안도 타다오.
 고교시절엔 복서로, 청년시절엔 건축 현장에서 치열한 나날을 보냈던 그는
 우연히 서점에서 설계도면을 본 후, 건축가의 꿈을 안고 유럽으로 향한다.
 현장에서 익힌 건축지식을 기반으로 콘크리트를 연구한 끝에
 누구도 만들 수 없는 건축물을 만들며 노출 콘크리트의 거장이 된 그의 이야기가 시작된다!"
알라딘,"모험, 가족, 판타지, 뮤지컬, 멜로/로맨스",128분,2019 .05.23 개봉,가이 리치,"메나 마수드(알라딘), 윌 스미스(지니), 나오미 스콧(자스민)",전체 관람가,"머나먼 사막 속 신비의 아그라바 왕국의 시대.
 좀도둑 ‘알라딘’은 마법사 ‘자파’의 의뢰로 마법 램프를 찾아 나섰다가
 주인에게 세 가지 소원을 들어주는 지니를 만나게 되고,
 자스민 공주의 마음을 얻으려다 생각도 못했던 모험에 휘말리게 되는데…"
알랭 뒤카스: 위대한 여정,다큐멘터리,80분,2019 .08.01 개봉,쥘 드 메스트르,알랭 뒤카스(본인),전체 관람가,"정상에 올랐지만 끊임없이 탐구하고,
 세상의 모든 맛을 알고 싶은 프렌치 요리의 거장, 알랭 뒤카스.
 베일에 싸여 있던 스타 셰프를 2년 간 따라다니며 엿본 그만의 요리,
 더 나아가 그만의 삶의 철학은 지금의 알랭 그 자체이다.
 베르사유 궁 안에 그의 레스토랑을 열기까지의 자연주의 미식 여행이 눈 앞에 펼쳐진다."
알리타: 배틀 엔젤,"액션, 모험, 멜로/로맨스, SF, 스릴러",122분,2019 .02.05 개봉,로버트 로드리게즈,"로사 살라자르(알리타), 크리스토프 왈츠(닥터 다이슨 이도), 키언 존슨(휴고)",12세 관람가,"모두가 갈망하는 공중도시와 그들을 위해 존재하는 고철도시로 나누어진 26세기.
 고철 더미 속 모든 기억을 잃은 채 깨어난 알리타는 마음 따뜻한 의사 이도의 보살핌으로 새로운 삶을 시작한다.
 이도는 사이보그인 알리타에게 특별한 과거의 비밀과 영혼이 존재한다는 사실을 깨닫고
 미스터리한 과거로부터 그녀를 지키고자 한다.
 한편, 새로운 친구 휴고는 알리타가 위험한 고철도시를 헤쳐나갈 수 있는 방법과 함께 기억을 되찾도록 돕는다.
 
 알리타가 자신의 과거에 다가 갈수록 도시를 지배하는 악랄한 세력들이 그녀를 노리며 제거하려고 하고
 자신이 착취와 약탈의 고철도시를 구할 수 있는 열쇠임을 깨닫게 된 알리타는
 사랑하는 가족과 친구, 새로운 세상을 위해 통제된 세상의 무시무시한 적들과 맞서게 되는데…"
암드,"액션, 스릴러",120분,2019 .04.26 개봉,마리오 반 피블스,마리오 반 피블스(치프),청소년 관람불가,"2018년 미국, 총기 난사 사건으로 국가는 떠들썩거린다.
 요원 직을 은퇴한 후 평범한 삶을 즐기고 있던 제이슨은 미용실에서 일을 시작하게 된다.
 그때 TV에서는 한 실종된 여학생에 대한 뉴스가 흘러나오고, 그날 밤 자신의 밑에서 일하던 요원인 존세가 찾아와 같은 정신 질환을 앓고 있음을 알게 된다.
 그 둘은 임무 도중 어떠한 약품에 중독된 것이라 짐작하고 사건을 파헤쳐 간다."
암전,"공포, 미스터리",86분,2019 .08.15 개봉,김진원,"서예지(박미정), 진선규(김재현)",15세 관람가,"8년째 공포영화를 준비하던 신인 감독 ‘미정’은
 어느 날 후배로부터 지나친 잔혹함으로 인해 상영이 금지된 영화에 대해 듣는다.
 실체를 추적하던 중 만난 그 영화의 감독 ‘재현’은
 ""그 영화는 잊어, 죽음보다 끔찍한 인생 살기 싫으면""이라고 경고하지만
 ‘미정’은 그의 경고를 무시한 채 더욱 더 그 영화에 집착한다.
 이후, 이유를 알 수 없이 벌어지는 기괴하고 끔찍한 일들.
 극장에 불이 꺼지는 순간, 공포는 바로 등 뒤에 있다"
애나벨 : 잊혀지지 않는 선율,공포,90분,2019 .12.05 개봉,제임스 쿨렌 브레삭,"스테파니 이스터스(클레어), 잭 워드",15세 관람가,"어린시절 어머니 수잔에게 강제로 예쁜 여성으로만 살아오길 훈련받았던 클레어는 남편 애런과 함께 수잔의 별세 이후,
 어머니 집으로 이사해서 살아가기로 하는데, 괴로웠던 과거, 외롭던 클레어의 상상속 친구 베서니와의 조우에 클레어의 불안증세는 더욱 심해져만 간다.
 변한없이 자신을 사랑해주는 애런과 상담을 도와주는 브라운박사의 도움에도 괴롭힘이 심해지는 베서니의 존재는 대체 무엇일까."
애나벨 집으로,"공포, 미스터리, 스릴러",106분,2019 .06.26 개봉,게리 도버먼,"패트릭 윌슨(에드 워렌), 베라 파미가(로랭 워렌), 맥케나 그레이스(주디 워렌)",15세 관람가,"퇴마사 워렌 부부는 저주 받은 인형 애나벨을 발견하고
 집에 있는 오컬트 뮤지엄 진열장에 격리시킨다.
 또 다른 초자연적인 현상을 연구하기 위해 워렌 부부가 떠난 사이,
 집에 남아있던 10살 딸 주디와 베이비시터는
 ‘절대 들어가지 말라’는 경고를 어기고 마는데…
 탈출한 애나벨은 모든 악령들을 깨우고,
 잊을 수 없는 공포의 밤을 준비한다."
애드 아스트라,"SF, 스릴러",123분,2019 .09.19 개봉,제임스 그레이,브래드 피트(로이 맥브라이드),12세 관람가,"미 육군 소령 ‘로이 맥브라이드’(브래드 피트)는
 우주의 지적생명체를 찾기 위한 ‘리마 프로젝트’를 수행하다 실종된 아버지를
 영웅이라 믿으며 우주 비행사의 꿈을 키웠다.
 
 어느 날, ‘로이’는 이상 현상으로 우주 안테나에서 지구로 추락하는 사고를 당하고
 인류를 위협할 전류 급증 현상인 이 ‘써지’ 사태가
 자신의 아버지가 벌인 위험한 실험에서 시작되었다는 이야기를 듣게 된다.
 
 믿고 있는 모든 것이 흔들린다!
 
 아버지가 살아 있다는 충격적인 사실과 함께
 그를 막아야 한다는 임무를 맡게 된 ‘로이’는 우주로 향하게 되는데…
 
 지금껏 본 적 없는 진짜 미래를 경험하라!"
애월,"멜로/로맨스, 드라마",101분,2019 .09.26 개봉,박철우,"이천희(이철이), 김혜나(한소월)",12세 관람가,"오토바이로 전국 일주를 하던 수현은
 제주도 애월에서 비운의 사고로 목숨을 잃는다.
 사고 이후, 수현의 연인 소월은 그리움에 잠겨
 애월을 떠나지 않은 채 살아가고 있다.
 한편, 둘의 가장 친한 친구였던 철이는 수현이 죽기 전 보낸 편지를
 3년이 지나서 받게 되고 무작정 애월로 떠난다.
 소월을 찾아와 그녀의 집에 잠시 머물게 되는 철이는
 마을 사람들과 함께 어울리며 애월에서의 소소한 일상을 보내고,
 철이와 소월은 그렇게 함께 지내며
 죽은 수현에 대한 그리움을 각자의 방식으로 극복하기 시작하는데...
 
 모든 걸 놓고 싶은 당신을 위로해줄 특별한 순간이 찾아옵니다"
애프터,"드라마, 멜로/로맨스",105분,2019 .08.22 개봉,제니 게이지,"히어로 파인즈 티핀(하딘 스콧), 조세핀 랭포드(테사 영)",15세 관람가,"첫 끌림
 대학 입학 후 첫 파티에 초대 받게 된 신입생 ‘테사’는
 진실게임을 하던 중 키스 벌칙에 걸리고 만다.
 상대는 학교에서 유명한 반항아 ‘하딘’.
 키스를 앞둔 0.1초 전, 모두가 주목하는 그 순간
 ‘테사’는 ‘하딘’의 입술을 거절하고 만다.
 
 첫 사랑
 강렬했던 첫 만남 이후, 마치 새로운 세상을 발견한 듯
 한번도 경험한 적 없던 감정에 눈을 뜨게 된 두 사람.
 ‘하딘’은 자신의 비밀 장소로 ‘테사’를 초대하고
 이제 두 사람은 서로를 모르기 전으로 절대 되돌아 갈 수 없음을 알게 되는데…
 
 첫 경험 그리고 <애프터>"
액츠 오브 바이올런스,"액션, 드라마",87분,2019 .07.15 개봉,브렛 도노후,"브루스 윌리스(에이머리), 콜 하우저(데클랜)",청소년 관람불가,"결혼식을 앞두고 있는 ‘로만’(애쉬튼 홈즈)의 약혼자 ‘미아’(멜리사 볼로나)가 납치되는 일이 벌어진다.
 ‘로만’은 군인 출신인 첫째 형 ‘데클랜’(콜 하우저), 둘째형 ‘브랜든’(숀 애수모어)과 함께 그녀가 있는 곳을 급습하지만 그 과정에서 경찰 ‘에이머리’(브루스 윌리스)에게 붙잡힌다.
 그리고 그에게서 더욱 최악의 사실을 듣게 되는 그들. ‘미아’를 데려간 놈들이 아주 질나쁜 인신매매 조직이라는 것.
 놈들이 FBI와 손잡고 유유히 법망을 피해가는 것에 분노한 형사 ‘에이머리’는 폭력으로 그들을 직접 처단하려는 형제들을 도와 자비 없는 응징을 실행한다."
앨리스 죽이기,다큐멘터리,81분,2019 .08.08 개봉,김상규,"신은미(본인), 정태일(본인), 황선(본인)",12세 관람가,"재미동포 신은미 씨는 우연한 기회에 북한을 여행하고,
 그곳에서 느낀 감동과 충격을 담은 사사로운 북한 여행기를 쓴다.
 그 여행기는 출간되어 남한에서 크게 주목받고, 북 콘서트까지 열린다.
 하지만 “대동강 맥주가 맛있었다“는 그녀의 말 한마디가
 ‘북한 고무찬양’으로 매도되어 점점 더 빨갛게 덧씌워지는데…
 
 말 한마디로 대한민국을 발칵 뒤집은
 2014년 희대의 레드 스캔들을 만난다!"
앳 퍼스트 라이트,"드라마, SF, 스릴러",91분,2019 .09.26 개봉,제이슨 스톤,"스테파니 스콧(알렉스), 테오도르 펠르랭(숀), 세이드 타그마오우이",12세 관람가,"어릴 적 서로 호감을 가지고 있던 알렉스(스테파니 스콧)와 숀(테오도르 펠르랭)은 마을 파티에서 우연히 만나게 된다.
 그 무렵 정체를 알 수 없는 괴 비행 물체의 움직임이 한 남자(사이드 타그마우이)에 의해 발견되고 저수지에서 남자 친구와 함께 수영을 하던 알렉스는 행방불명 되어 실종 신고 된다.
 다음날 마을에 나타난 알렉스는 자동차 등 물체를 움직이는 초능력을 갖게 되면서 이유도 모른 채 정부 당국으로 부터 쫓기게 되고 숀은 그녀를 보호하게 되면서 커다란 위험에 처하는데..."
앵그리 버드 2: 독수리 왕국의 침공,"애니메이션, 액션",96분,2019 .08.07 개봉,서럽 밴 오먼,"제이슨 서디키스(레드 목소리), 조시 게드(척 목소리), 대니 맥브라이드(밤 목소리)",전체 관람가,"호시탐탐 알을 탐내는 식신돼마왕 ‘레너드’를 물리치고
 아싸에서 인싸가 된 버드랜드의 악동 히어로 ‘레드’
 평생 앙숙인 이들에게 ‘공공의 적’이 나타났다!
 
 얼음 공격을 퍼붓는 이글랜드의 예민 보스
 ‘제타’에 맞서기 위해 한 팀으로 뭉친 그들!
 과연 이들의 연합 작전은 성공할 수 있을까?
 
 어제는 적! 오늘은 친구? 아슬아슬한 팀플레이가 시작된다!"
앵커,드라마,78분,2019 .11.28 개봉,최정민,박수연(한주),15세 관람가,"계주의 마지막 주자인 ‘앵커’ 역할을 맡은
 산청의 고등학교 육상부 소녀 ‘한주’.
 어느 날 ‘한주’의 할아버지가 사고로 위급해지고, 동생 ‘영준’ 마저 사라지는데...
 
 세상을 알기 위해 달리는 소녀가 만난 새로운 세계!"
야곱의 사다리,"스릴러, 액션",89분,2019 .10.19 개봉,데이빗 M. 로젠탈,"마이클 엘리, 제시 윌리엄스, 칼라 소우자",15세 관람가,"전투에서 치명상을 입은 군인을 응급 치료하는 제이콥.
 환자가 동생인 것을 알고 충격을 받지만 살리지 못한다.
 1년 후, 죽은 동생이 살아서 돌아오고
 환청과 함께 환각이 제이콥의 정신세계를 지배한다.
 악마의 환영과 강박의 원인을 뒤쫓으면서
 동생과 참전한 전쟁에 숨겨진 음모와 비밀을 마주하는데…
 보이는 것만이 전부가 아니다!"
